name,region,address
보문사(원주),강원 원주시,강원도 원주시 고문골길 270
구 철원제일교회,강원 철원군,강원도 철원군 철원읍 금강산로 319
비룡폭포,강원 속초시,강원도 속초시 설악산로
영월 김삿갓면,강원 영월군,강원도 영월군 김삿갓면 김삿갓로 216-22
배두둑호박넝쿨마을,강원 평창군,강원도 평창군 대화면 선애길 90
백도해변,강원 고성군,강원도 고성군 죽왕면
춘천봉의산성,강원 춘천시,강원도 춘천시 번개시장길4번길 20-6
산속호수마을,강원 화천군,강원도 화천군 화천읍 호음로 806
허난설헌 생가터,강원 강릉시,강원도 강릉시 난설헌로193번길 1-16
도직해변,강원 강릉시,강원도 강릉시 옥계면 도직리
금학산관광농원,강원 홍천군,강원도 홍천군 북방면 팔봉산로 2050-88
가령폭포,강원 홍천군,강원 홍천군 내촌면 와야리
초곡해수욕장,강원 삼척시,강원도 삼척시 근덕면 초곡2길
감성마을 이외수 문학관,강원 화천군,강원도 화천군 상서면 감성마을길 157
영진항,강원 강릉시,강원 강릉시 연곡면 영진리 2-3
춘천최재근가옥,강원 춘천시,강원도 춘천시 신동면 솟발길 33-11
마차진해변,강원 고성군,강원도 고성군 현내면
하평해변,강원 강릉시,강원도 강릉시 사천면 진리해변길 155
달뜨락마을,강원 정선군,강원도 정선군 정선읍 가내길 16
아리랑학교 추억의 박물관,강원 정선군,강원도 정선군 신동읍 함백로 565
춘천 솔바우마을,강원 춘천시,강원도 춘천시 사북면 솔바우길 195
옥녀탕,강원 인제군,강원도 인제군 북면 설악로
소지섭길,강원 양구군,강원도 양구군 방산면 두타연로 8
최초석탄발견지탑,강원 태백시,강원도 태백시 금천동
양양향교,강원 양양군,강원도 양양군 양양읍 거마천로 52-20
소금산,강원 원주시,강원도 원주시 지정면 간현리
동활계곡,강원 삼척시,강원도 삼척시 가곡면 가곡천로
미천골계곡,강원 양양군,강원도 양양군 서면 구룡령로
경포가시연습지,강원 강릉시,강원도 강릉시 운정동 670
화로구이 골목,강원 홍천군,강원도 홍천군 홍천읍 오안로 3-2
중봉계곡,강원 삼척시,강원도 삼척시 하장면 중봉당골길
백덕산(평창),강원 평창군,강원 평창군 평창읍 원당리
한반도섬,강원 양구군,강원도 양구군 양구읍
삼운사(춘천),강원 춘천시,강원도 춘천시 후석로441번길 12
강릉 대공산성,강원 강릉시,강원도 강릉시 성산면 보광리
거진11리해변,강원 고성군,강원도 고성군 거진읍 거진항길
강릉 한울타리마을,강원 강릉시,강원도 강릉시 옥계면 풍동로 406
철원 누에마을,강원 철원군,강원도 철원군 근남면 도덕동길 13
당골계곡,강원 태백시,강원도 태백시 천제단길 168
계방산(평창),강원 평창군,강원도 평창군 용평면 운두령로 1243
두루웰 자연휴양림,강원 철원군,강원도 철원군 갈말읍 지경1길 69
노추산,강원 정선군,강원도 정선군 여량면 노추산로 912-2
영원사(원주),강원 원주시,강원도 원주시 판부면 영원산성길 685
불바라기약수터,강원 양양군,강원도 양양군 서면 미천골길 115
구성폭포 (구송폭포),강원 춘천시,강원도 춘천시 북산면 오봉산길 674
태백 시티투어,강원 태백시,강원도 태백시 서황지로 79
국립축산과학원 한우연구소,강원 평창군,강원도 평창군 대관령면 경강로 4937
주천강자연휴양림,강원 횡성군,강원도 횡성군 둔내면 강변로영랑6길 115
소금강장천마을,강원 강릉시,강원도 강릉시 연곡면 진고개로 1502
내리계곡,강원 영월군,강원도 영월군 김삿갓면 내리계곡로
부연약수,강원 강릉시,강원도 강릉시 연곡면 삼산리
용화저수지,강원 철원군,강원도 철원군 갈말읍 신철원리
구만동계곡,강원 인제군,강원도 인제군 북면 용대리
원평 팜스테이,강원 춘천시,강원도 춘천시 사북면 말고개길 82-35
연곡 신왕리 마암터마을,강원 강릉시,강원도 강릉시 연곡면 신왕길 388-1
봉포김여사카페,강원 고성군,강원도 고성군 토성면 토성로 96
동해향교,강원 동해시,강원도 동해시 승지로 84-3
신약수(가리골약수),강원 평창군,강원 평창군 용평면 속사2리
금당계곡,강원 평창군,강원도 평창군 대화면 금당계곡로 766-2
그린에너지 산업관광 비지터센터,강원 영월군,강원도 영월군 영월읍 팔괴1농공단지길
초도마을,강원 고성군,강원도 고성군 현내면 초도항길 60
외옹치마을,강원 속초시,강원도 속초시 해오름로 77-16
DMZ산림두드림센터,강원 양구군,강원도 양구군 양구읍 박수근로 367
매봉산,강원 영월군,강원도 영월군 중동면 성황골길 127-33
인제 미산리 개인약수,강원 인제군,강원도 인제군 상남면 미산리 산1 일원
다물자연학교,강원 홍천군,강원도 홍천군 북방면 도사곡길 805
펀치볼지구전투전적비,강원 양구군,강원도 양구군 동면 팔랑리
대굴령마을,강원 강릉시,강원도 강릉시 성산면 성연로 17
춘천 근화동 당간지주,강원 춘천시,강원도 춘천시 당간지주길
이효석 생가터,강원 평창군,강원도 평창군 봉평면 이효석길 33-11
어성전계곡,강원 양양군,강원도 양양군 현북면 어성전길 93-98
도솔산 해병대전투전적지,강원 양구군,강원도 양구군 해안면
구룡산(강원),강원 영월군,강원도 영월군 무릉도원면 운학리 1111-5
봉복사(횡성),강원 횡성군,강원도 횡성군 청일면 청일로 909-88
춘천김정은가옥,강원 춘천시,강원도 춘천시 신동면 솟발1길 44
동산포해변,강원 양양군,강원도 양양군 현남면 동해대로 912
천은사계곡(원주),강원 원주시,강원도 원주시 귀래면 귀래리
인제 냇강마을,강원 인제군,강원도 인제군 북면 냇강마을안길 32
장전계곡,강원 평창군,강원도 평창군 진부면 장전길 2
속초해안로,강원 속초시,강원도 속초시 영랑해안길
해산전망대,강원 화천군,강원도 화천군 화천읍 동촌리 산11-7
삼척 영경묘,강원 삼척시,강원도 삼척시 미로면
월천유원지,강원 삼척시,강원도 삼척시 원덕읍 월천리
행구수변공원,강원 원주시,강원도 원주시 행구동 1026
화천 토속어류생태체험관,강원 화천군,강원도 화천군 간동면 어룡동길 366
철원향교,강원 철원군,강원도 철원군 철원읍 금학로 591
간성향교,강원 고성군,강원도 고성군 간성읍 진부령로 2659
동명서원,강원 양양군,강원도 양양군 양양읍 서원길 44-9
자작도해변,강원 고성군,강원도 고성군 죽왕면 문암진리
월둔동굴,강원 태백시,강원도 태백시 원동 산117번지
작은후진해수욕장,강원 삼척시,강원도 삼척시 새천년도로 467
공수전리 마을관리휴양지,강원 양양군,강원도 양양군 서면 구룡령로 2829-7
미륵산,강원 원주시,강원도 원주시 귀래면 용암동막길
계방산(홍천),강원 홍천군,강원도 홍천군 내면 대한동길 363-8
후곡약수터,강원 양구군,강원도 양구군 동면 후곡리
신장절공묘역,강원 춘천시,강원도 춘천시 서면 방동리
철원역사(舍),강원 철원군,강원도 철원군 철원읍 외촌리
원주교항리석조불두,강원 원주시,강원도 원주시 소초면 치악로 2966
88공원,강원 화천군,강원도 화천군 간동면 어룡동길 42-50
양구 국토정중앙배꼽마을,강원 양구군,강원도 양구군 남면 봉화산로 425
봉산서재,강원 평창군,강원도 평창군 봉평면 봉산서재길 17
구봉대산,강원 영월군,강원도 영월군 무릉도원면 무릉법흥로 1229
제왕산/능경봉,강원 강릉시,강원 강릉시 성산면 어흘리
추대계곡,강원 인제군,강원도 인제군 기린면 방동리
장신유원지,강원 고성군,강원도 고성군 간성읍 소똥령마을길 32
충효사,강원 원주시,강원도 원주시 문막읍 빈계리
팔석정,강원 평창군,강원도 평창군 봉평면 쉴바위길 33-11
홍천 풍암리 동학혁명군전적지,강원 홍천군,강원도 홍천군 서석면 풍암길 11
구봉산,강원 춘천시,강원도 춘천시 동면 순환대로 1154-115
강촌 출렁다리공원,강원 춘천시,강원도 춘천시 남산면 강촌리 671-5
고석정 (한탄강 국가지질공원),강원 철원군,강원도 철원군 동송읍 태봉로 1825
삼봉약수,강원 홍천군,강원도 홍천군 내면 월둔길 63-2
의암수력발전소,강원 춘천시,강원도 춘천시 신동면 옛경춘로 62-15
하추리계곡,강원 인제군,강원도 인제군 인제읍 하추리
청옥산,강원 동해시,강원도 평창군 미탄면 청옥산길 557-4
운암정,강원 횡성군,강원도 횡성군 횡성읍 한우로 193
동해기관차승무사업소(동해역),강원 동해시,강원도 동해시 동해역길 69
고원통계곡,강원 인제군,강원도 인제군 북면 원통리
의민공사우,강원 원주시,강원도 원주시 지정면 지정로 626
정선향교,강원 정선군,강원도 정선군 정선읍 비봉로 67-9
잣봉(영월),강원 영월군,강원도 영월군 영월읍 어라연길 4
용산서원(동해),강원 동해시,강원도 동해시 효자로 583
양구근현대사박물관,강원 양구군,강원도 양구군 양구읍 금강산로 439-51
마대산,강원 영월군,강원도 영월군 김삿갓면 김삿갓로 216-22
물안마을,강원 춘천시,강원 춘천시 북산면 부귀리
파로호수변생태탐방로,강원 양구군,강원도 양구군 양구읍 고대리
양구공예공방,강원 양구군,강원도 양구군 양구읍 박수근로257번길 10
현산공원,강원 양양군,강원도 양양군 양양읍 군청길 1
공작산,강원 홍천군,강원도 홍천군 동면
횡성호,강원 횡성군,강원도 횡성군 갑천면 중금리
한섬해변,강원 동해시,강원도 동해시 한섬해안길 9
광대곡,강원 정선군,강원도 정선군 화암면 광대곡길
팔랑폭포,강원 양구군,강원도 양구군 동면
두위봉,강원 정선군,강원도 정선군 사북읍 지장천로 436-27
남대천(강릉),강원 강릉시,강원도 강릉시 성산면 구산안길
상원사,강원 춘천시,강원도 춘천시 서면 박사로 169-47
극락암(강원),강원 고성군,강원도 고성군 간성읍 교동2길 26
기사문마을,강원 양양군,강원도 양양군 현북면 기사문길 22
송담서원(강릉),강원 강릉시,강원도 강릉시 강동면 송담서원길 27-7
횡성향교,강원 횡성군,강원도 횡성군 횡성읍 향교로 12
흥법사지,강원 원주시,강원도 원주시 지정면 안창리
황토구들마을,강원 평창군,강원도 평창군 용평면 의풍포길 23-10
에어링화천,강원 화천군,강원도 화천군 화천읍 강변로 2-54
명주사(양양),강원 양양군,강원도 양양군 현북면 어성전길 93-229
인제 하늘여울소치마을,강원 인제군,강원도 인제군 남면 부평정자로 744
수림대마을 [녹색체험관광마을],강원 평창군,강원도 평창군 봉평면 수림대길 167-25
위봉문,강원 춘천시,강원도 춘천시 중앙로 1
삼척 고무릉환선마을,강원 삼척시,강원도 삼척시 신기면 고무릉길 49
청간해변,강원 고성군,강원도 고성군 토성면
지암계곡,강원 춘천시,강원 춘천시 사북면 지암리
허난설헌 솔숲,강원 강릉시,강원도 강릉시 난설헌로193번길 1-16
김제남 신도비,강원 원주시,강원도 원주시 지정면 흥법사지길 18
계족산(영월),강원 영월군,강원도 영월군 영월읍 정양리 451
강원고생대국가지질공원,강원 정선군,강원도 정선군 정선읍 봉양3길 21
거진1리해변,강원 고성군,강원도 고성군 거진읍 거탄진로
노봉해변,강원 동해시,강원도 동해시 동해대로
태화산(강원),강원 영월군,강원도 영월군 김삿갓면
꺼먹다리,강원 화천군,강원도 화천군 화천읍 대이리 468-3
매월당김시습기념관,강원 강릉시,강원도 강릉시 운정길 85
철원승일공원,강원 철원군,강원도 철원군 갈말읍 내대리 일대
구은사,강원 철원군,강원도 철원군 근남면 호국로 7003-23
척산족욕공원,강원 속초시,강원도 속초시 관광로 277
육담폭포,강원 속초시,강원도 속초시 설악산로
산명저수지,강원 철원군,강원도 철원군 철원읍 산명리
반암해변,강원 고성군,강원도 고성군 거진읍
대진마을,강원 동해시,강원도 동해시 대진항길 46
세렴폭포,강원 원주시,강원도 원주시 소초면 구룡사로 427
후진마을,강원 삼척시,강원도 삼척시 새천년도로 460
늘햇살 농촌체험 만우마을,강원 동해시,강원도 동해시 마상천길 308
홍천향교,강원 홍천군,강원도 홍천군 홍천읍 석화로 101-14
영천사(원주),강원 원주시,강원도 원주시 치악로 2006-19
대포마을,강원 속초시,강원도 속초시 대포항1길 6-13
막동계곡,강원 평창군,강원도 평창군 진부면 오대천로
평창향교,강원 평창군,강원도 평창군 평창읍 향교길 148
양구 수목원,강원 양구군,강원도 양구군 동면 숨골로310번길 169
설악산소공원,강원 속초시,강원도 속초시 설악산로 1091
양구인문학박물관,강원 양구군,강원도 양구군 양구읍 파로호로869번길 101
강원숲체험장,강원 춘천시,강원도 춘천시 서면 삿갓봉길 102
하맹방해변,강원 삼척시,강원도 삼척시 근덕면 하맹방길
문암1리해변 (자작도),강원 고성군,강원도 고성군 죽왕면 자작도선사길
명성산성(울음산성),강원 철원군,강원도 철원군 갈말읍
내평계곡,강원 삼척시,강원도 삼척시 근덕면 내평길
둔전계곡,강원 양양군,강원도 양양군 강현면 둔전리
토왕성폭포,강원 속초시,강원도 속초시 설악산로
원주 반곡역사,강원 원주시,강원도 원주시 달마중3길 30
밧도내마을 [녹색관광마을],강원 영월군,강원도 영월군 주천면 밧도내길 11-34
물치마을,강원 양양군,강원도 양양군 강현면 물치천로 28
가야동계곡,강원 인제군,강원도 인제군 북면 용대리
삼척 궁촌리 음나무,강원 삼척시,강원도 삼척시 근덕면 궁촌2길 58
동명마을,강원 속초시,강원도 속초시 장안로4길
삼척 가시오가피마을,강원 삼척시,강원도 삼척시 노곡면 문의재로 2470
태백 경찰서 망루,강원 태백시,강원도 태백시 장성로 26
철원 용암대지 (한탄강 국가지질공원),강원 철원군,강원도 철원군 철원읍 사요리
전진항,강원 양양군,강원도 양양군 강현면 낙산사로 54-26
이효석 문학의 숲,강원 평창군,강원도 평창군 봉평면 창동리 산139
장미공원,강원 원주시,강원도 원주시 단계동 854
추곡약수터,강원 춘천시,강원도 춘천시 북산면 추곡약수길 89-1
화천 구운리 산천어마을,강원 화천군,강원도 화천군 상서면 만산동로 1042
영월향교,강원 영월군,강원도 영월군 영월읍 영월향교길 64
선바위산(영월),강원 영월군,강원도 영월군 상동읍 선바위길 246
마평정수장 홍보관,강원 삼척시,강원도 삼척시 회강길 450
임원해변,강원 삼척시,강원도 삼척시 원덕읍 임원리
중동마을,강원 정선군,강원도 정선군 여량면 중동길 38
태기산풍력발전단지,강원 횡성군,강원도 횡성군 둔내면 태기리 산
용연사템플스테이,강원 강릉시,강원도 강릉시 사천면 중앙서로 961
청대산,강원 속초시,강원도 속초시 청대로 207
철원충렬사지,강원 철원군,강원도 철원군 김화읍 생창길 603
스카이워크,강원 인제군,강원도 인제군 인제읍 비봉로44번길 81
화천 토속어류생태관,강원 화천군,강원도 화천군 화천읍 상승로 126-1
경천묘,강원 원주시,강원도 원주시 귀래면 미륵산길 200
수달연구센터,강원 화천군,강원도 화천군 간동면 간척월명로 869-129
영은사(삼척),강원 삼척시,강원도 삼척시 근덕면 궁촌길 1162
동대산,강원 강릉시,강원도 강릉시 연곡면 삼산리
고포마을,강원 삼척시,강원 삼척시 원덕읍 월천리
원주 조엄묘역,강원 원주시,강원도 원주시 지정면 간현리
문암해변,강원 삼척시,강원도 삼척시 근덕면 초곡길 340
가칠봉 지구전투전적지,강원 양구군,강원도 양구군 해안면
문암2리해변,강원 고성군,강원도 고성군 죽왕면
딴산,강원 화천군,강원도 화천군 화천읍
수상한마법학교,강원 강릉시,강원도 강릉시 사천면 미노길 103
정암해변,강원 양양군,강원도 양양군 강현면 정암리
양구 해시계,강원 양구군,강원도 양구군 양구읍 중앙길 53
곡운구곡 (강원평화지역 국가지질공원),강원 화천군,강원도 화천군 사내면 용담리
봉산동당간지주,강원 원주시,강원도 원주시 개봉교길 41
양양 진전사지 도의선사탑,강원 양양군,강원도 양양군 강현면 화채봉길 368
화천 계성리 석등,강원 화천군,강원도 화천군 하남면 계성리
오미마을,강원 양구군,강원도 양구군 방산면 평화로 4818
삼화사 템플스테이,강원 동해시,강원도 동해시 삼화로 538
초도해변,강원 고성군,강원도 고성군 현내면 초도항길
㈜강원심층수,강원 고성군,강원도 고성군 죽왕면 심층수길 124-19
서강,강원 영월군,강원도 영월군 한반도면 옹정리
직연폭포,강원 양구군,강원 양구군 방산면 장평리
창절사,강원 영월군,강원도 영월군 영월읍 단종로 60
충렬탑(강원),강원 춘천시,강원도 춘천시 우두동
일출공원,강원 동해시,강원도 동해시 해맞이길 267
삼포2리해변,강원 고성군,강원도 고성군 죽왕면
철원평화문화광장,강원 철원군,강원도 철원군 동송읍 강산리
백두대간 생태수목원,강원 정선군,강원도 정선군 임계면 임계리
묵호항 울릉도 관광여객선,강원 동해시,강원도 동해시 임항로 129
광치계곡,강원 양구군,강원도 양구군 남면
산천어커피박물관,강원 화천군,강원도 화천군 화천읍 상승로2길 21
남노일 강변,강원 홍천군,강원도 홍천군 남면 남노일로
상정바위산,강원 정선군,강원도 정선군 북평면 문곡강변길 505
부곡계곡,강원 횡성군,강원 횡성군 강림면
만덕사,강원 태백시,강원도 태백시 문곡소도동 196
대진1리해변,강원 고성군,강원도 고성군 현내면 한나루로4길 1
흥양3기,강원 원주시,강원도 원주시 소초면 흥양리
한재밑해변,강원 삼척시,강원도 삼척시 근덕면 삼척로 3840
양지리마을,강원 철원군,강원도 철원군 동송읍 양지3길 13-30
검무정골 생태문화탐방로,강원 양구군,강원도 양구군 양구읍 군량리
판대천,강원 원주시,강원 원주시 지정면 판대리
계조암(속초),강원 속초시,강원도 속초시 설악동
감추해변,강원 동해시,강원도 동해시 해안로 120
통일공원함정전시관,강원 강릉시,강원도 강릉시 강동면 율곡로 1616
장사(사진)마을,강원 속초시,강원도 속초시 장사항해안길 58
삼척향교,강원 삼척시,강원도 삼척시 향교길 34
팔효자각,강원 양구군,강원도 양구군 양구읍 송청리
사자산,강원 영월군,강원도 영월군 무릉도원면 법흥리
상맹방해변,강원 삼척시,강원도 삼척시 근덕면 상맹방길
산양서원,강원 삼척시,강원도 삼척시 원덕읍 산양서원1길 24
심마니마을(가시오가피 마을),강원 삼척시,강원도 삼척시 노곡면 문의재로 2470
방동리고구려고분,강원 춘천시,강원도 춘천시 서면 신숭겸로 272-21
나릿골 감성마을,강원 삼척시,강원도 삼척시 나리골길 12
비봉산(양구),강원 양구군,강원 양구군 양구읍
영월음향역사박물관,강원 영월군,강원도 영월군 김삿갓면 내리계곡로 18
뒷뜨루관광농원,강원 강릉시,강원도 강릉시 사천면 청솔공원길 108
주문리마을,강원 강릉시,강원도 강릉시 주문진읍 주문로
광주동솔밭,강원 인제군,강원도 인제군 상남면 하남리
방동계곡,강원 인제군,강원도 인제군 기린면 현리
소금강양떼목장,강원 강릉시,강원도 강릉시 연곡면 진고개로 1321
산천어시네마,강원 화천군,강원도 화천군 화천읍 상승로2길 25-10
고고산,강원 영월군,강원도 정선군 신동읍 고림길
구 조선식산은행 원주지점,강원 원주시,강원도 원주시 중앙로 88
노동서원,강원 홍천군,강원도 홍천군 서면 팔봉산로 1198-2
선달산,강원 영월군,경상북도 봉화군 물야면 생달길
경포솔향온천,강원 강릉시,강원도 강릉시 해안로 292
빛의 사원,강원 철원군,강원도 철원군 철원읍
용머리 공원,강원 양구군,강원도 양구군 양구읍
용대리 매바위 인공폭포,강원 인제군,강원도 인제군 북면 용대리
강릉 대도호부 관아,강원 강릉시,강원도 강릉시 임영로131번길 6
탁장사고을,강원 양양군,강원도 양양군 현북면 어성전길 258
용추폭포,강원 동해시,강원도 동해시 삼화로 538
38해변,강원 양양군,강원도 양양군 현북면 기사문길 29
아야진항,강원 고성군,강원도 고성군 토성면 아야진해변길 48
강재구공원,강원 홍천군,강원도 홍천군 북방면 성동로 275
용화마을,강원 삼척시,강원도 삼척시 근덕면 용화해변길 23
자연아놀자 체험학습박물관,강원 강릉시,강원도 강릉시 난설헌로 105
두루미평화마을,강원 철원군,강원도 철원군 철원읍 묘장로 301
서상리삼층석탑,강원 춘천시,강원도 춘천시 서면
덕가산,강원 영월군,강원도 영월군 김삿갓면 영월동로 1547
영모전,강원 영월군,강원도 영월군 영월읍 영모전길 148
용암사,강원 태백시,강원도 태백시 태백로 2000-119
정동진해안로,강원 강릉시,강원도 강릉시 강동면 안인리 708
동송저수지,강원 철원군,강원도 철원군 동송읍
소양호(인제),강원 인제군,강원도 인제군 남면 원남로 133
팔랑1리마을,강원 양구군,강원도 양구군 동면 바랑길 87
바우지움조각미술관,강원 고성군,강원도 고성군 토성면 원암온천3길 37
영월미디어기자박물관,강원 영월군,강원도 영월군 한반도면 서강로 1094
용암리선사유적,강원 화천군,강원도 화천군 하남면 춘화로 3281
동화마을수목원,강원 원주시,강원도 원주시 문막읍 동화골길 170
홀로세 생태학교,강원 횡성군,강원도 횡성군 갑천면 갑천로690번길 156
피크 아일랜드,강원 평창군,강원도 평창군 대관령면 올림픽로 715
북한강,강원 화천군,강원도 화천군 일대
남전약수,강원 인제군,강원도 인제군 남면 남전리 산 145 일원
양구향교,강원 양구군,강원도 양구군 양구읍 관공서로16번길 5-4
천문인 마을,강원 횡성군,강원도 횡성군 강림면 월안1길
컬러팜웨딩 포레스트 (관광두레 주민사업체),강원 홍천군,강원도 홍천군 서면 도롱골길 195-19
육향산,강원 삼척시,강원도 삼척시 새천년도로 16
오분해변,강원 삼척시,강원도 삼척시 오분동 208-1
민충사,강원 영월군,강원도 영월군 영월읍 금강공원길 136
수항계곡,강원 평창군,강원도 평창군 진부면 오대천로
MS 빌리지 (푸른계곡 관광농원),강원 양양군,강원도 양양군 서면 관대문길 31
심밭골농원,강원 원주시,강원도 원주시 신림면 심박골길 1
평창 월정사 석조보살좌상,강원 평창군,강원도 평창군 진부면 오대산로 176
가원습지 생태자연공원,강원 동해시,강원도 동해시 지가길 100
이승휴 상징 조형물,강원 삼척시,강원도 삼척시 미로면 내미로리
천곡항,강원 동해시,강원도 동해시 천곡동
어달항,강원 동해시,강원도 동해시 일출로 230
강원 경찰충혼탑,강원 춘천시,강원도 춘천시 서면 박사로 1210
오세암,강원 인제군,강원도 인제군 북면 백담로 1325
강릉 예술창작인촌,강원 강릉시,강원도 강릉시 죽헌길 140-12
목우산,강원 영월군,강원도 영월군 중동면 응고개길 169-2
쌍계사(홍천),강원 홍천군,강원도 홍천군 내촌면 여창길 402
캔싱턴해변,강원 고성군,강원도 고성군 토성면 동해대로 4800
갯마을해변,강원 양양군,강원도 양양군 현남면 안남애길 48
용양늪,강원 철원군,강원도 철원군 김화읍 생창길 479
삼불사(고성),강원 고성군,강원도 고성군 거진읍 화포리 181
양양국제공항,강원 양양군,강원도 양양군 손양면 공항로 201
사명산,강원 양구군,강원 양구군 양구읍 월명리
국지산,강원 영월군,강원도 영월군 남면 국지골길
잣나무 연리지,강원 태백시,강원도 태백시 소도동 산 33-1
