name,region,address
충주세계무술박물관,충북 충주시,충청북도 충주시 남한강로 24
난계국악박물관,충북 영동군,충청북도 영동군 심천면 국악로 9
오대호아트팩토리,충북 충주시,충청북도 충주시 앙성면 가곡로 1434
단양 다누리아쿠아리움,충북 단양군,충청북도 단양군 단양읍 수변로 111
술박물관 리쿼리움,충북 충주시,충청북도 충주시 중앙탑면 탑정안길 12
공군박물관,충북 청주시,충청북도 청주시 상당구 남일면 단재로 635
충주고구려비전시관,충북 충주시,충청북도 충주시 중앙탑면 감노로 2319
충주고구려천문과학관,충북 충주시,충청북도 충주시 중앙탑면 묘곡내동길 100
진천 종박물관,충북 진천군,충청북도 진천군 진천읍 백곡로 1504-12
운보의 집,충북 청주시,충청북도 청주시 청원구 내수읍 형동2길 92-41
수몰역사관,충북 제천시,충청북도 제천시 청풍면 청풍호로 2048
국립청주박물관 어린이박물관,충북 청주시,충청북도 청주시 상당구 명암로 143
철박물관,충북 음성군,충청북도 음성군 감곡면 영산로 360
충주박물관,충북 충주시,충청북도 충주시 중앙탑면 중앙탑길 112-28
정지용 문학관,충북 옥천군,충청북도 옥천군 옥천읍 향수길 56
청주백제유물전시관,충북 청주시,충청북도 청주시 흥덕구 1순환로438번길 9
수양개선사유물전시관,충북 단양군,충청북도 단양군 적성면 수양개유적로 390
국립현대미술관(청주관),충북 청주시,충청북도 청주시 청원구 상당로 314
정크아트갤러리(오대호 스튜디오),충북 음성군,충청북도 음성군 음성읍 가섭길 219
괴산한지체험박물관,충북 괴산군,충청북도 괴산군 연풍면 원풍로 233
증평민속체험박물관,충북 증평군,충청북도 증평군 증평읍 둔덕길 89
국립청주박물관,충북 청주시,충청북도 청주시 상당구 명암로 143
오장환문학관,충북 보은군,충청북도 보은군 회인면 회인로5길 12
솔향공원,충북 보은군,충청북도 보은군 속리산면 속리산로 600
제천문화회관,충북 제천시,충청북도 제천시 의림대로6길 32
한독의약박물관,충북 음성군,충청북도 음성군 대소면 대풍산단로 78
의림지 역사박물관,충북 제천시,충청북도 제천시 의림대로47길 7
한국잠사박물관(청주),충북 청주시,충청북도 청주시 흥덕구 강내면 청주역로 213-52
조동리 선사유적 박물관,충북 충주시,충청북도 충주시 동량면 조동1길 15
청주시립대청호미술관,충북 청주시,충청북도 청주시 상당구 문의면 대청호반로 721
박정우 염색갤러리,충북 제천시,충청북도 제천시 청풍면 문화재길 30
능강솟대문화공간,충북 제천시,충청북도 제천시 수산면 옥순봉로 1100
충주시택견원,충북 충주시,충청북도 충주시 중원대로 3324
제천의병전시관,충북 제천시,충청북도 제천시 봉양읍 의암로 566-7
제천기적의도서관,충북 제천시,충청북도 제천시 용두천로38길 30
청주예술의전당,충북 청주시,충청북도 청주시 서원구 흥덕로 69
충주 민물고기전시관,충북 충주시,충청북도 충주시 충주호수로 423
충북문화관,충북 청주시,충청북도 청주시 상당구 대성로122번길 67
감우재전승기념관,충북 음성군,충청북도 음성군 음성읍 소여리
음성문화예술회관,충북 음성군,충청북도 음성군 음성읍 예술로 102
수안보곤충박물관,충북 충주시,충청북도 충주시 수안보면 관동길 152
한국교원대학교 교육박물관,충북 청주시,충청북도 청주시 흥덕구 강내면 태성탑연로 250
호암공원생태전시관,충북 충주시,충청북도 충주시 상아배이길 84
충주커피박물관,충북 충주시,충청북도 충주시 살미면 월악로 432
음성 향토민속자료전시관,충북 음성군,충청북도 음성군 음성읍 설성공원길 10-7
반기문 기념관,충북 음성군,충청북도 음성군 원남면 행치길 17-1
영동군 난계국악당,충북 영동군,충청북도 영동군 영동읍 성안길 11
호암예술관,충북 충주시,충청북도 충주시 중원대로 3306
증평문화원,충북 증평군,충청북도 증평군 증평읍 문화로 75
영동문화원,충북 영동군,충청북도 영동군 영동읍 영동천2길 29
충북학생교육문화원,충북 청주시,충청북도 청주시 청원구 공항로287번길 56
예뿌리민속박물관,충북 청주시,충청북도 청주시 상당구 가덕면 금거1길 10
시네마360,충북 제천시,충북 제천시 청풍면 물태리 산6-29 제천청풍호반케이블카 2층
매괴박물관,충북 음성군,충청북도 음성군 감곡면 성당길 10
성마루미술관,충북 충주시,충청북도 충주시 대소원면 장성길 38-1
농민문학기념관,충북 영동군,충청북도 영동군 매곡면 노천2길 5-1
음성문화원,충북 음성군,충청북도 음성군 음성읍 수정로 36
단양문화원,충북 단양군,충청북도 단양군 단양읍 중앙1로 32
옥천문화원,충북 옥천군,충청북도 옥천군 옥천읍 관성로 35
한운사기념관,충북 괴산군,충청북도 괴산군 청안면 청안읍내로6길 3
충주시립도서관,충북 충주시,충청북도 충주시 예성로 207
무심갤러리,충북 청주시,충청북도 청주시 서원구 사직대로 175
괴산문화원,충북 괴산군,충청북도 괴산군 괴산읍 읍내로 268
제천시립도서관,충북 제천시,충청북도 제천시 내제로 318
지적박물관,충북 제천시,충청북도 제천시 금성면 양월로 34
충주문화원,충북 충주시,충청북도 충주시 탄금대안길 33
김재옥교사기념관,충북 충주시,충청북도 충주시 신니면 신덕로 301
보은문화원,충북 보은군,충청북도 보은군 보은읍 뱃들로 54
춘추민속관,충북 옥천군,충청북도 옥천군 옥천읍 향수3길 19
옥천문화예술회관,충북 옥천군,충청북도 옥천군 옥천읍 문정1길 32
제천문화원,충북 제천시,충청북도 제천시 의림대로 125
청주문화원,충북 청주시,충청북도 청주시 상당구 단재로 361
우륵당,충북 충주시,충청북도 충주시 중원대로 3324
진천향토민속자료전시관,충북 진천군,충청북도 진천군 진천읍 문진로 1323
청원문화원,충북 청주시,충청북도 청주시 상당구 단재로 361
충주과수과학관,충북 충주시,충청북도 충주시 동량면 충원대로 1346
환경문화전시장,충북 괴산군,충청북도 괴산군 청천면 괴산로 1248
충청북도자연과학교육원 과학전시관,충북 청주시,충청북도 청주시 상당구 대성로 150
진천문화원,충북 진천군,충청북도 진천군 진천읍 문화로 79
주철장 전수교육관,충북 진천군,충청북도 진천군 진천읍 장관리
생거판화 미술관,충북 진천군,충청북도 진천군 진천읍 백곡로 1504-12
향산리 미술촌,충북 충주시,충청북도 충주시 살미면 팔봉향산길 489
김종명 나뭇잎 예술 갤러리,충북 제천시,충청북도 제천시 봉양읍 배론성지길 36
청주시한국공예관,충북 청주시,충청북도 청주시 청원구 상당로 314
