name,region,address,lat,lon
이사부크루즈,전남 여수시,전라남도 여수시 돌산읍 돌산로 3617-18,34.665556,127.7529493
이순신공원(여수),전남 여수시,전라남도 여수시 웅천동,34.7471249,127.6840325
이순신광장,전남 여수시,전라남도 여수시 중앙동,34.7399174,127.7361151
이순신대교,전남 여수시,전라남도 여수시 묘도7길 110,34.8886144,127.7010376
이천서원,전남 순천시,전라남도 순천시 상사면 동백길 56,34.9499937,127.4475122
이충무공 벽파진 전첩비,전남 진도군,전라남도 진도군 고군면 벽파길 90,34.5369726,126.3445319
이충무공승전공원,전남 진도군,전라남도 진도군 군내면 진도대로 8439-19,34.5715488,126.2995706
이충무공자당기거지,전남 여수시,전라남도 여수시 신월로 195,34.7334762,127.7078715
이훈동 정원,전남 목포시,전라남도 목포시 유동로 63,34.7876783,126.3800558
이흥서원,전남 영광군,전라남도 영광군 영광읍 영광로7길 46-79,35.2533904,126.5230305
익금해수욕장,전남 고흥군,전라남도 고흥군 금산면 익금해변길 32,34.4302878,127.1461337
일본인지주가옥,전남 나주시,전라남도 나주시 예향로 3871-4,34.9995121,126.7132076
일심사(신안),전남 신안군,전라남도 신안군 지도읍 읍내길 67-13,35.0616194,126.208109
일월사(보성),전남 보성군,전라남도 보성군 율어면 유신길 195,34.8677057,127.2300173
일제강점기 건축물들,전남 목포시,전라남도 목포시 영산로29번길 6,34.7875251,126.3821609
임대정원림,전남 화순군,전라남도 화순군 사평면 상사1길 48,34.9994766,127.0950991
임자 대광해수욕장,전남 신안군,전라남도 신안군 임자면 대광해수욕장길 178,35.1028855,126.0731603
임자도,전남 신안군,전라남도 신안군 임자면 대광해수욕장길 179,35.1026817,126.0724741
임포마을,전남 여수시,전라남도 여수시 돌산읍 율림리,34.6074242,127.7819101
자산공원,전남 여수시,전라남도 여수시 자산공원길 54,34.7390252,127.7481509
자산서원,전남 함평군,전라남도 함평군 엄다면 곤재로 688,35.0013479,126.516352
자연드림파크(구례),전남 구례군,전라남도 구례군 용방면 용산로 107-73,35.2750575,127.4123763
자은 백길해수욕장,전남 신안군,전라남도 신안군 자은면 자은서부1길 163-119,34.8497303,126.0401208
자은 분계해수욕장,전남 신안군,전라남도 신안군 자은면 자은서부2길 669,34.8720376,125.9822322
자은도,전남 신안군,전라남도 신안군 자은면 구영1길 8,34.8843367,126.0474085
장군도(수중성),전남 여수시,전라남도 여수시 고소1길 58,34.7393799,127.7385046
장도,전남 보성군,전라남도 보성군 벌교읍 장도리,34.7972038,127.4640499
장도,전남 진도군,전라남도 진도군 지산면 가학장도길 1,34.4559726,126.1006152
장등마을,전남 여수시,전라남도 여수시 화양면,34.7081585,127.613556
장등해변,전남 여수시,전라남도 여수시 화양면 장수리,34.6558924,127.585786
장보고 동상,전남 완도군,전라남도 완도군 완도읍 청해진로 1565-2,34.3437121,126.7316875
장보고공원,전남 완도군,전라남도 완도군 완도읍 청해진로 1380-138,34.3537084,126.7173033
장산도,전남 신안군,전라남도 신안군 장산면 장산중앙길 2,34.6429651,126.148876
장성 가인마을 한봉단지,전남 장성군,전라남도 장성군 북하면 약수리,35.4363094,126.8745481
장성 입암산성,전남 장성군,전라남도 장성군 북하면 신성리,35.4451119,126.8486041
장성 자라뫼마을 [농촌전통테마],전남 장성군,전라남도 장성군 북이면 백양로 26,35.4287446,126.8085668
장성 축령산 편백숲 (장성 치유의 숲),전남 장성군,전라남도 장성군 서삼면 추암로 716,35.3688434,126.7315215
장성 황룡 전적,전남 장성군,전라남도 장성군 황룡면 내황길 50-8,35.2882905,126.7492393
장성원덕리미륵석불,전남 장성군,전라남도 장성군 북이면 원덕리,35.4596377,126.7981517
장성향교,전남 장성군,전라남도 장성군 장성읍 성산2길 102,35.3242469,126.8139986
장성호 출렁다리(장성호 수변길),전남 장성군,전라남도 장성군 장성읍 봉덕리,35.3624542,126.8237106
장성호관광지,전남 장성군,전라남도 장성군 북하면 쌍웅리,35.4167096,126.8467007
장수풍뎅이마을,전남 장흥군,전라남도 장흥군 유치면 반월리,34.8139205,126.814486
장암정,전남 영암군,전라남도 영암군 영암읍 무덕정길 63,34.8056113,126.7303496
장좌마을,전남 완도군,전라남도 완도군 완도읍 청해진로1369번길,34.35887,126.7307801
장촌마을,전남 여수시,전라남도 여수시 삼산면 서도리,34.0452665,127.2885507
장흥 방촌리 석장승,전남 장흥군,전라남도 장흥군 관산읍 장흥대로 1674,34.5538439,126.9435362
장흥 방촌리 지석묘군,전남 장흥군,전라남도 장흥군 관산읍 방촌리,34.5459341,126.9437986
장흥 사인정,전남 장흥군,전라남도 장흥군 장흥읍 진흥로 891,34.6531998,126.8729379
장흥 삼산리 후박나무,전남 장흥군,전라남도 장흥군 관산읍 산서1길 13,34.5233052,126.9562951
장흥 상선약수마을,전남 장흥군,전남 장흥군 장흥읍 평화리,34.66211,126.9125123
장흥 어산리 푸조나무,전남 장흥군,전라남도 장흥군 용산면,34.614923,126.9141086
장흥 오헌고택 (구 위성탁 가옥),전남 장흥군,전라남도 장흥군 관산읍 방촌1길 44,34.548988,126.939622
장흥 옥당리 효자송,전남 장흥군,전라남도 장흥군 관산읍 효자송길 124,34.5533615,126.9340794
장흥 위성룡가옥,전남 장흥군,전라남도 장흥군 관산읍 방촌길 101,34.5488905,126.9499267
장흥 키조개마을,전남 장흥군,전라남도 장흥군 안양면 수문용곡로 107,34.631236,127.0286751
장흥 회령진성,전남 장흥군,전라남도 장흥군 회진면 회진리,34.4800806,126.9316921
장흥다목적댐 물 문화관,전남 장흥군,전라남도 장흥군 유치면 지천길 52-227,34.7535138,126.8839293
장흥향교,전남 장흥군,전라남도 장흥군 장흥읍 교촌남외길 33,34.6744202,126.8934315
재동서원,전남 고흥군,전라남도 고흥군 대서면 동서로 243-51,34.7771095,127.3039269
적금대교(여수),전남 여수시,전라남도 여수시 화정면 적금리 117,34.6202336,127.5230295
적대봉,전남 고흥군,전라남도 고흥군 금산면,34.4588747,127.12501
적자봉(격자봉),전남 완도군,전남 완도군 보길면 부용리,34.1511875,126.5447378
전남 강진다원,전남 강진군,전라남도 강진군 성전면 백운로 93-25,34.7408101,126.7061942
전남 담양 창평 [슬로시티],전남 담양군,전라남도 담양군 창평면 돌담길 56-24,35.2350638,127.017967
전남권 환경성질환 예방관리센터,전남 보성군,전라남도 보성군 웅치면 대산길 329-126,34.7060349,127.0042896
접도,전남 진도군,전라남도 진도군 의신면 황모길 81,34.3887602,126.300561
정남진 전망대,전남 장흥군,전라남도 장흥군 관산읍 정남진해안로 242-58,34.5118195,126.974722
정남진 편백숲 우드랜드,전남 장흥군,전라남도 장흥군 장흥읍 우드랜드길 180,34.66765,126.9341757
정남진(장흥),전남 장흥군,전라남도 장흥군 관산읍,34.5615493,126.9389392
정남진(편백숲우드랜드),전남 장흥군,전라남도 장흥군 장흥읍 우드랜드길 180,34.66765,126.9341757
정남진해양낚시공원,전남 장흥군,전라남도 장흥군 회진면 해양낚시길 137,34.4701055,126.9768207
정도마을,전남 완도군,전남 완도군 완도읍 정도리,34.304429,126.6940976
정송강 유적(식영정·송강정),전남 담양군,전라남도 담양군 남면 가사문학로 859,35.1606144,127.0432613
정수루,전남 나주시,전라남도 나주시 금계동 13-18,35.032271,126.7160969
정수사(강진),전남 강진군,전라남도 강진군 대구면 정수사길 403,34.5332124,126.838753
정안사(장흥),전남 장흥군,전라남도 장흥군 관산읍 당동길 6-25,34.5538233,126.9310129
정열사비,전남 나주시,전라남도 나주시 정렬사길 43,35.0457791,126.7114269
정응민예적지(판소리공원),전남 보성군,전라남도 보성군 회천면 영천길 9,34.6979089,127.0755957
정혜사(순천),전남 순천시,전라남도 순천시 서면 정혜사길 32,35.0618985,127.5140527
제암산,전남 장흥군,전라남도 장흥군 장흥읍 금산신기길 131,34.6990903,126.9545905
제암산자연휴양림,전남 보성군,전라남도 보성군 웅치면 대산길 330,34.6994712,126.9874331
조계산도립공원,전남 순천시,전라남도 순천시 승주읍 승주괴목1길,34.992039,127.3489559
조금나루해수욕장,전남 무안군,전라남도 무안군 망운면 송현리 1070-3,34.9958363,126.3359717
조도(조도6군도),전남 진도군,전라남도 진도군 조도면,34.2965705,126.0475147
조화대교(여수),전남 여수시,전라남도 여수시 화양면,34.7081585,127.613556
주도,전남 완도군,전라남도 완도군 완도읍 군내리,34.3108342,126.7628683
주봉서원,전남 강진군,전라남도 강진군 옴천면 장강로 1785-3,34.7592533,126.7698749
주암댐 물 문화관,전남 순천시,전라남도 순천시 상사면 상사호길 555,34.9492937,127.4146707
주암댐지석묘군,전남 순천시,전라남도 순천시 송광면 우산리,34.9655001,127.2280673
주암호와 상사호,전남 순천시,전라남도 순천시 송광면,34.9741016,127.2639392
주작산,전남 강진군,전라남도 강진군 신전면 수양리,34.5210149,126.7017758
주작산자연휴양림,전남 강진군,전라남도 강진군 신전면 주작산길 398,34.5210038,126.6866623
주지도(손가락섬),전남 진도군,전라남도 진도군 조도면 가사주지도길,34.488823,126.0821559
죽녹원,전남 담양군,전라남도 담양군 담양읍 죽녹원로 119,35.3258488,126.9863188
죽도 등대,전남 진도군,전라남도 진도군 조도면 맹골죽도길 9-37,34.2240118,125.846643
죽도(고흥),전남 고흥군,전라남도 고흥군 도화면,34.5101075,127.3174203
죽도봉공원,전남 순천시,전라남도 순천시 죽도봉길,34.9546876,127.4954905
죽림사(나주),전남 나주시,전라남도 나주시 남평읍 풍림죽림길 255,35.0405214,126.8836834
죽림서원,전남 장성군,전라남도 장성군 북이면 만무부동길 3-14,35.4269913,126.7842209
죽림어촌체험마을,전남 진도군,전라남도 진도군 임회면 헌복동길,34.3831137,126.2517196
죽수서원,전남 화순군,전라남도 화순군 한천면 학포로 1786-45,34.9853251,126.9728551
죽수절제아문,전남 화순군,전라남도 화순군 능주면 죽수길 73,34.98976,126.9582417
죽정서원,전남 영암군,전라남도 영암군 군서면 죽정서원길 19,34.7629254,126.6228619
죽화경,전남 담양군,전라남도 담양군 봉산면 유산길 11-7,35.2553031,126.9585343
중대리계곡,전남 구례군,전라남도 구례군 간전면 남도대교로,35.1916364,127.5993278
중리해수욕장,전남 완도군,전라남도 완도군 보길면 중통리,34.1636817,126.5810706
중산리계곡,전남 구례군,경상남도 산청군 시천면 지리산대로,35.2888009,127.7739882
중흥 골드스파&리조트 워터락,전남 나주시,전라남도 나주시 다도면 나주호로 558-314,34.9613912,126.8542257
중흥사(광양),전남 광양시,전라남도 광양시 옥룡면 중흥로 263-100,35.0245534,127.6077427
증도 모실길,전남 신안군,전라남도 신안군 증도면 증도 모실길,35.002795,126.1397376
증도 우전해수욕장,전남 신안군,전라남도 신안군 증도면 지도증도로 1684,34.9714482,126.1378685
증도(신안),전남 신안군,전라남도 신안군 증도면 문준경길 188,35.0028526,126.1398352
지곡서원,전남 화순군,전라남도 화순군 화순읍 서당길 58-16,35.0360218,126.9936656
지도,전남 신안군,전라남도 신안군 지도읍 읍내길 67-5,35.0612672,126.207573
지도향교,전남 신안군,전라남도 신안군 지도읍 서촌길 54-11,35.063526,126.2063025
지리산 10경,전남 구례군,전남 구례군 산동면,35.3158318,127.439444
지리산 남부 국립공원,전남 구례군,전라남도 구례군 마산면 화엄사로 356,35.2411032,127.4879786
지리산 만복대,전남 구례군,전라남도 구례군 산동면,35.3158318,127.439444
지리산 생태탐방연수원,전남 구례군,전라남도 구례군 마산면 화엄사로 402-25,35.2404581,127.4897484
지리산국립공원(지리산 노고단),전남 구례군,전라남도 구례군 산동면 노고단로,35.3053244,127.5194678
지리산온천랜드,전남 구례군,전라남도 구례군 산동면 지리산온천로 261,35.3184937,127.4577881
지리산치즈랜드,전남 구례군,전라남도 구례군 산동면 산업로 1590-62,35.3034427,127.4283128
지리해수욕장,전남 완도군,전라남도 완도군 청산면 청산로 1462-58,34.1948489,126.8621192
지죽도,전남 고흥군,전라남도 고흥군 도화면 지호길 27-38,34.4392745,127.3063521
진도,전남 진도군,전라남도 진도군 진도읍,34.4807356,126.262934
진도 고니류 도래지,전남 진도군,전라남도 진도군 진도읍 서부해안로,34.5183824,126.214622
진도 남도진성,전남 진도군,전라남도 진도군 임회면 남동리,34.3632439,126.1702759
진도 상만리 오층석탑과 비자나무,전남 진도군,전라남도 진도군 임회면 상만길 58,34.3837964,126.2140689
진도 소포검정쌀마을,전남 진도군,전라남도 진도군 지산면 소포길 119-4,34.4829043,126.2024746
진도 신비의 바닷길,전남 진도군,전라남도 진도군 고군면 신비의바닷길 148,34.4272106,126.3509199
진도 용장성,전남 진도군,전라남도 진도군 군내면 용장산성길 92,34.5160938,126.3380223
진도 운림산방,전남 진도군,전라남도 진도군 의신면 운림산방로 315,34.4664904,126.3081234
진도 의신사천마을 [농촌체험휴양마을],전남 진도군,전라남도 진도군 의신면 의신사천길 26,34.4660902,126.2983855
진도 접도어촌체험마을,전남 진도군,전라남도 진도군 의신면 황모길 81,34.3887602,126.300561
진도대교,전남 진도군,전라남도 진도군 고군면 녹진리,34.5634896,126.282317
진도읍성,전남 진도군,전라남도 진도군 진도읍 성내리,34.4854566,126.2655395
진도타워,전남 진도군,전라남도 진도군 군내면 만금길 112-41,34.5659583,126.3024816
진도향교,전남 진도군,전라남도 진도군 진도읍 진도향교길 68-5,34.490892,126.2610549
진산리해수욕장,전남 완도군,전라남도 완도군 소안면 소안남로,34.1273098,126.6502909
진원리오층석탑,전남 장성군,전라남도 장성군 진원면 장성군,35.2731425,126.8334473
진지도,전남 고흥군,전라남도 고흥군 과역면 백일리,34.6940957,127.4350332
진흥사(해남),전남 해남군,전라남도 해남군 현산면 입제길 442,34.4455835,126.6150937
짱뚱어다리,전남 신안군,전라남도 신안군 증도면 대초리,34.9822525,126.1570462
창평 남극루,전남 담양군,전라남도 담양군 창평면 삼천리,35.2381676,127.0250649
창평향교,전남 담양군,전라남도 담양군 고서면 교촌길 43-11,35.2166996,126.9845011
천관사(장흥),전남 장흥군,전라남도 장흥군 관산읍 칠관로 1272-473,34.5511833,126.9049216
천관산 문학공원,전남 장흥군,전라남도 장흥군 대덕읍 연지리,34.5192507,126.9035333
천관산도립공원,전남 장흥군,전라남도 장흥군 관산읍 옥당리 산22-3,34.5484972,126.9319199
천등산(고흥),전남 고흥군,전라남도 고흥군 풍양면,34.5755446,127.2419989
천사대교,전남 신안군,전라남도 신안군 암태면 신석리,34.8611142,126.1241857
천사섬 분재공원,전남 신안군,전라남도 신안군 압해읍 수락길 330,34.8436019,126.2521601
천은사(구례),전남 구례군,전라남도 구례군 광의면 노고단로 209,35.2737355,127.4762418
천일염전,전남 영광군,전라남도 영광군 백수읍 백수로3길 361,35.2834724,126.3348849
천축사(순천),전남 순천시,전라남도 순천시 서면 정혜사길 32,35.0618985,127.5140527
천태산,전남 강진군,전라남도 강진군 대구면 용운리,34.5287382,126.8349482
천황사(영암),전남 영암군,전라남도 영암군 영암읍 천황사로 280-82,34.7715575,126.7162518
철마공원,전남 진도군,전라남도 진도군 진도읍 철마길 17,34.4853445,126.2637543
첨도,전남 고흥군,전라남도 고흥군 포두면 오취길 709,34.5721543,127.4473871
첨찰산,전남 진도군,전라남도 진도군 의신면 사천리,34.4669722,126.3020412
청계동계곡,전남 곡성군,전라남도 곡성군 곡성읍 신기길 49-4,35.3071784,127.2881135
청산도,전남 완도군,전라남도 완도군 청산면 도청3길 30-1,34.1797839,126.8587632
청산도 느림보마을(느린섬 여행학교),전남 완도군,전라남도 완도군 청산면 청산로 541,34.1808842,126.8954405
청용어촌체험마을,전남 진도군,전라남도 진도군 진도읍 청룡안길 130-12,34.524899,126.2159049
청자골엄지마을,전남 강진군,전라남도 강진군 옴천면 옴천로 760-23,34.7597155,126.7734332
초도(여수),전남 여수시,전라남도 여수시 경호동 산232,34.692773,127.712768
초의선사 유적지,전남 무안군,전라남도 무안군 삼향읍 초의길 30,34.8541988,126.4161091
총지사지석장승,전남 무안군,전라남도 무안군 몽탄면 대치리,34.9495257,126.4763986
최경회사당,전남 화순군,전라남도 화순군 화순읍 다산길 55,35.051439,126.9974117
추도,전남 여수시,전라남도 여수시 화정면 낭도리,34.6089984,127.5543849
추월산,전남 담양군,전라남도 담양군 용면 추월산로 981,35.4023161,126.9996585
춤추는 바다분수,전남 목포시,전라남도 목포시 미항로 115,34.7967765,126.4322293
충무사,전남 순천시,전라남도 순천시 해룡면 신성2길 145,34.916164,127.5774363
충무사(고흥),전남 고흥군,전라남도 고흥군 도화면 충무사길 150,34.4849886,127.335033
충의사(최경회장군),전남 화순군,전라남도 화순군 동면 충의로 409,35.0383465,127.0109767
충절사(보성),전남 보성군,전라남도 보성군 득량면 삼정리,34.7780282,127.1398686
취도,전남 고흥군,전라남도 고흥군 포두면 오취안길 43-14,34.5645828,127.4104352
탐진강,전남 장흥군,전라남도 장흥군 유치면,34.802265,126.8392246
탐진강 생태습지원,전남 장흥군,전라남도 장흥군 장흥읍 건산리,34.6763132,126.9107115
탐진강-강진만생태탐방로,전남 장흥군,전라남도 장흥군 장흥읍 건산리 일대,34.6763132,126.9107115
태도,전남 신안군,전라남도 신안군 흑산면 상태도길 25,34.4365681,125.2872615
태안사,전남 곡성군,전라남도 곡성군 죽곡면 태안로 622-215,35.1322481,127.384809
태영사,전남 해남군,전라남도 해남군 북평면 천태산길 191,34.4219855,126.6159061
태평사,전남 나주시,전라남도 나주시 노안면 금성산길 387-83,35.059437,126.7054363
태평염생식물원,전남 신안군,전남 신안군 증도면 증동리,35.0063567,126.150116
태평염전,전남 신안군,전라남도 신안군 증도면 지도증도로 1053-11,34.9967442,126.1772999
태평염전 해양힐링스파,전남 신안군,전라남도 신안군 증도면 지도증도로 1083-4,34.9935923,126.1757379
톱머리 해수욕장,전남 무안군,전라남도 무안군 망운면 피서리,34.9898597,126.3894174
톱머리마을,전남 무안군,전남 무안군 망운면 피서리,34.9898597,126.3894174
통리해수욕장,전남 완도군,전라남도 완도군 보길면 보길동로 219,34.158125,126.5781478
파도목장,전남 무안군,전라남도 무안군 현경면 해운로 185,35.0651597,126.4512814
판소리성지,전남 보성군,전라남도 보성군 회천면 영천길 9,34.6979089,127.0755957
팔금도,전남 신안군,전라남도 신안군 팔금면 삼층석탑길 161,34.7849251,126.1425532
팔열부정각,전남 함평군,전라남도 함평군 월야면 월야리,35.1826814,126.6291367
팔영산자연휴양림,전남 고흥군,전라남도 고흥군 영남면 팔영로 1347-418,34.6215956,127.4402471
퍼플교,전남 신안군,전라남도 신안군 안좌면 소곡두리길 257-35,34.7184934,126.1202326
표충사(전남),전남 해남군,전라남도 해남군 삼산면 대흥사길 400,34.4763245,126.6168261
품바발상지,전남 무안군,전라남도 무안군 일로읍 의산리,34.8389184,126.5175707
풍류해수욕장,전남 고흥군,전남 고흥군 두원면 풍류리,34.666488,127.235277
플라타너스 별빛 달빛 길,전남 담양군,전라남도 담양군 담양읍 죽녹원로 130,35.3203789,126.9861812
피아골계곡,전남 구례군,전라남도 구례군 토지면 피아골로,35.2206018,127.5980189
필암서원 [유네스코 세계문화유산],전남 장성군,전라남도 장성군 황룡면 필암서원로 184,35.3106967,126.7517337
하구자도,전남 진도군,전라남도 진도군 의신면 구자도2길 6,34.3218277,126.3007654
하낙월도,전남 영광군,전라남도 영광군 낙월면 하낙월리,35.1994792,126.1259655
하늘빛수목원,전남 장흥군,전라남도 장흥군 용산면 장흥대로 2746,34.6352948,126.9037605
하멜 체류지와 강진 성동리 은행나무,전남 강진군,전라남도 강진군 병영면 성동리,34.7217217,126.8137688
하의도,전남 신안군,전라남도 신안군 하의면 곰실길 20,34.6063175,126.0364998
하의도 토지항쟁비와 덕봉강당,전남 신안군,전라남도 신안군 하의면 웅곡리,34.5982134,126.0440284
하저어촌체험마을,전남 강진군,전라남도 강진군 대구면 저두바닷길 19,34.527244,126.791297
하조도,전남 진도군,전라남도 진도군 조도면 창리길 47,34.2965871,126.0475212
하조도 등대,전남 진도군,전라남도 진도군 조도면 조도등대길 429,34.3108601,126.0877185
하태도,전남 신안군,전라남도 신안군 흑산면 장굴길 49-1,34.4285767,125.2870315
하화도,전남 여수시,전라남도 여수시 화정면 아래꽃섬1길,34.5949211,127.620697
하화도(고흥),전남 고흥군,전라남도 고흥군 도양읍 하화도길,34.4967741,127.1474189
학서암,전남 완도군,전라남도 완도군 생일면 생일로601번길 23-230,34.3268109,126.9869782
학포당,전남 화순군,전라남도 화순군 이양면 쌍봉길 74-3,34.8732304,127.0411626
한국차문화공원,전남 보성군,전라남도 보성군 보성읍 녹차로 775,34.7198297,127.0819753
한국차박물관,전남 보성군,전라남도 보성군 보성읍 녹차로 775,34.7198297,127.0819753
한국트로트가요센터,전남 영암군,전라남도 영암군 영암읍 기찬랜드로 19-10,34.7922651,126.6859479
한마음공원,전남 영광군,전라남도 영광군 홍농읍 홍농로7길 24,35.4157388,126.4315753
한산사(여수),전남 여수시,전라남도 여수시 구봉산길 114,34.7399637,127.7123693
한산사지삼층석탑,전남 화순군,전라남도 화순군 동복면 탑동길 21-23,35.0851175,127.1283173
한천자연휴양림,전남 화순군,전라남도 화순군 한천면 죽헌로 719,34.9873034,127.0409199
할미꽃 한재공원,전남 장흥군,전라남도 장흥군 회진면 덕산리 793-6,34.4877684,126.9473242
함평 고막천 석교,전남 함평군,전라남도 함평군 학교면 고막천로,35.0300168,126.5878116
함평 기각리 붉가시나무 자생북한지,전남 함평군,전라남도 함평군 함평읍 기각리,35.0708861,126.5224377
함평 양재리의 이팝나무,전남 함평군,전라남도 함평군 손불면 양재리,35.167362,126.4077728
함평 예덕리 신덕 고분군,전남 함평군,전라남도 함평군 월야면 예덕리,35.2236032,126.6119784
함평 용월리 지석묘군,전남 함평군,전라남도 함평군 월야면 용월리,35.160881,126.62432
함평 자연생태공원,전남 함평군,전라남도 함평군 대동면 학동로 1398-77,35.1356236,126.5030859
함평 향교리 느티나무·팽나무·개서어나무 숲,전남 함평군,전라남도 함평군 대동면 향교길 38-8,35.0654986,126.5341763
함평곤충생태관,전남 함평군,전라남도 함평군 함평읍 운교리 500-1번지,35.1356236,126.5030859
함평예덕리고분군,전남 함평군,전라남도 함평군 월야면 예덕리,35.2236032,126.6119784
함평죽암리고분,전남 함평군,전라남도 함평군 손불면 죽암리,35.1224584,126.4760362
함평해수찜,전남 함평군,전라남도 함평군 손불면 석산로 69,35.1005591,126.4647688
함평향교,전남 함평군,전라남도 함평군 대동면 대동길 45,35.0686,126.5350637
해남 간척지 담수호 주변 철새도래지,전남 해남군,전남 해남군 화산면,34.4913014,126.5153317
해남 동해김치마을,전남 해남군,전라남도 해남군 북평면 동해길 97,34.4365266,126.6359382
해남 명량대첩비,전남 해남군,전라남도 해남군 문내면 우수영안길 34,34.5925035,126.3104915
해남 목포구 등대,전남 해남군,전라남도 해남군 화원면 매봉길 582,34.7617113,126.2983013
해남 민정기 가옥,전남 해남군,전라남도 해남군 해남읍 백야길 36,34.5427585,126.5685391
해남 방춘정,전남 해남군,전라남도 해남군 계곡면 방춘길 123-4,34.6564067,126.6321043
