name,region,address,lat,lon
성불사(광양),전남 광양시,전라남도 광양시 봉강면 성불로 1150-183,35.0927224,127.5714627
세량지,전남 화순군,전라남도 화순군 화순읍 세량리 97,35.0786696,126.9199475
세방낙조 전망대,전남 진도군,전라남도 진도군 지산면 가학리,34.4275819,126.1053471
세방마을,전남 진도군,전라남도 진도군 지산면 세방길 6,34.4424625,126.1089437
소등섬,전남 장흥군,전라남도 장흥군 용산면 상발리 산225,34.6046577,127.0043885
소록도,전남 고흥군,전라남도 고흥군 도양읍 소록리,34.5130554,127.1269187
소리도 등대,전남 여수시,전라남도 여수시 남면 덕포길 133,34.4115673,127.8007752
소안도,전남 완도군,전라남도 완도군 소안면,34.174664,126.6509363
소안항,전남 완도군,전라남도 완도군 소안면 소안로 6,34.1799596,126.6349647
소호동동다리,전남 여수시,전라남도 여수시 소호로 392,34.7382226,127.6502351
손죽도,전남 여수시,전라남도 여수시 삼산면 손죽길 7,34.2904995,127.3635906
송계 어촌체험마을,전남 무안군,전라남도 무안군 해제면 만송로 916,35.1528015,126.3396569
송광사 포교당(보성),전남 보성군,전라남도 보성군 벌교읍 태백산맥길 93-10,34.8487929,127.3382708
송광사(순천),전남 순천시,전라남도 순천시 송광면 송광사안길 100,35.0032944,127.2753863
송광암,전남 고흥군,전라남도 고흥군 금산면 금산중촌길 266,34.4546951,127.1427641
송도,전남 진도군,전라남도 진도군 조도면 가사도리,34.4815801,126.0486598
송석마을,전남 무안군,전라남도 무안군 해제면 송석리,35.1433615,126.3377629
송석정,전남 화순군,전라남도 화순군 이양면 강정길 68,34.9361572,126.9898298
송석정유원지,전남 화순군,전라남도 화순군 이양면 강정길 68,34.9361572,126.9898298
송이도,전남 영광군,전라남도 영광군 낙월면 송이리,35.2828165,126.1460729
송이도마을,전남 영광군,전라남도 영광군 낙월면 송이리,35.2828165,126.1460729
송재 서재필선생 생가와 기념공원,전남 보성군,전라남도 보성군 문덕면 용암길 8,34.9582434,127.1955197
송지 대죽리 조개잡이 체험장,전남 해남군,전라남도 해남군 송지면 소죽리 807-1,34.3496396,126.5220295
송천서원,전남 순천시,전라남도 순천시 별량면 송천1길 59,34.8673998,127.4528591
송평마을,전남 해남군,전라남도 해남군 화산면 평호리,34.4394388,126.475728
송평해변,전남 해남군,전라남도 해남군 화산면 평호길 450,34.4355072,126.4716333
송호해수욕장,전남 해남군,전라남도 해남군 송지면 땅끝해안로 1827,34.306393,126.523026
수도암(고흥),전남 고흥군,전라남도 고흥군 두원면 운곡길 204,34.6254775,127.330226
수도암(곡성),전남 곡성군,전라남도 곡성군 옥과면 설옥길 81-158,35.2962989,127.1041224
수락도,전남 고흥군,전라남도 고흥군 봉래면 모래금길 375-3,34.4806468,127.4027686
수락폭포,전남 구례군,전라남도 구례군 산동면 수락길,35.3480993,127.4576375
수문해수욕장,전남 장흥군,전라남도 장흥군 안양면 수문용곡로 194,34.6356346,127.0355321
수암서원,전남 강진군,전라남도 강진군 성전면 동령길 51,34.6923065,126.7382006
수인산과 수인산성,전남 강진군,전라남도 강진군 병영면 지로리 산 26-8,34.7171307,126.8430492
순천 검단산성,전남 순천시,전라남도 순천시 해룡면 성산리,34.9143702,127.5498772
순천 고인돌 공원,전남 순천시,전라남도 순천시 송광면 고인돌길 543,34.9793819,127.2255771
순천 낙안읍성,전남 순천시,전라남도 순천시 낙안면 충민길 30,34.9062615,127.3418512
순천 송광사 천자암 쌍향수(곱향나무),전남 순천시,전라남도 순천시 송광면 천자암길 105,34.9812916,127.2899422
순천 오픈세트장,전남 순천시,전라남도 순천시 비례골길 24,34.9570037,127.5375471
순천 용오름마을 [농촌전통테마마을],전남 순천시,전라남도 순천시 주암면 운룡2길 17,35.0921171,127.202188
순천 용줄다리기마을,전남 순천시,전라남도 순천시 해룡면 해창길 3,34.8939334,127.531591
순천 향매실마을,전남 순천시,전라남도 순천시 월등면 계월길 138,35.0620845,127.4045195
순천만 국가정원,전남 순천시,전라남도 순천시 국가정원1호길 47,34.9289309,127.4988865
순천만 용산전망대 (S자 물길),전남 순천시,전라남도 순천시 순천만길 513-25,34.885971,127.5090298
순천만 자연생태공원,전남 순천시,전라남도 순천시 순천만길 513-25,34.885971,127.5090298
순천만 화포포구,전남 순천시,전라남도 순천시 별량면 학산리,34.8607041,127.483775
순천만백리길,전남 순천시,전라남도 순천시 해룡면 와온길 133,34.8458532,127.5259534
"순천만습지 (구, 순천만자연생태공원)",전남 순천시,전라남도 순천시 순천만길 513-25,34.885971,127.5090298
순천생태마을,전남 순천시,전라남도 순천시 승주읍 고산도목길 9,35.0665271,127.3603168
순천시낙안면꽃마차마을,전남 순천시,전라남도 순천시 낙안면 금산리,34.9355401,127.3558971
순천시별량면거차뻘배체험마을,전남 순천시,전라남도 순천시 별량면 거차길 57-16,34.8369274,127.4485255
순천시생태관광체험학습센터,전남 순천시,전라남도 순천시 국가정원1호길 47,34.9289309,127.4988865
순천시승주읍순천생태마을,전남 순천시,전라남도 순천시 승주읍 고산도목길 9,35.0665271,127.3603168
순천시월등면향매실마을,전남 순천시,전라남도 순천시 월등면 계월길 138,35.0620845,127.4045195
순천시주암면순천용오름마을,전남 순천시,전라남도 순천시 주암면 운룡1길 41-2,35.0888518,127.2013763
순천역 (철도체험학습장),전남 순천시,전라남도 순천시 팔마로 135,34.9459141,127.5031036
순천왜성,전남 순천시,전라남도 순천시 해룡면 신성리,34.9123393,127.5750766
순천자연휴양림,전남 순천시,전라남도 순천시 서면 청소년수련원길 170,35.0462597,127.4772736
순천전통야생차체험관,전남 순천시,전라남도 순천시 승주읍 선암사길 450,34.9967199,127.3305972
순천향교,전남 순천시,전라남도 순천시 향교길 60,34.9541844,127.4793052
스카이큐브,전남 순천시,전라남도 순천시 강변로 435,34.9475607,127.4943805
스파리조트 안단테,전남 장흥군,전라남도 장흥군 안양면 수문용곡로 270,34.6381187,127.0428175
"슬로시티, 신안군 증도",전남 신안군,전라남도 신안군 증도면 문준경길 188,35.0028526,126.1398352
승달산,전남 무안군,전라남도 무안군 청계면 월선리,34.8912053,126.4563118
시가문화유적지,전남 담양군,전라남도 담양군 가사문학면 가사문학로 877,35.1606144,127.0432613
시산도,전남 고흥군,전라남도 고흥군 도양읍 시산석금길,34.3964778,127.2564398
시호도,전남 고흥군,전라남도 고흥군 동일면 덕흥리,34.5339119,127.4558637
신광수 다원,전남 순천시,전라남도 순천시 승주읍 선암사길 386,34.990934,127.3517721
신도,전남 신안군,전라남도 신안군 하의면 신도길 34,34.5987331,125.9762969
신도해변,전남 신안군,전라남도 신안군 하의면 신도길 163,34.5881364,125.9749976
신리어촌체험마을,전남 장흥군,전라남도 장흥군 대덕읍 신리옹암로 294,34.4440617,126.8808445
신안 가거도 등대,전남 신안군,전라남도 신안군 흑산면 대풍리길 2-21,34.0870171,125.1218
신안 비금도 대동염전,전남 신안군,전라남도 신안군 비금면 서남문로 200,34.7693636,125.981501
신안튤립공원,전남 신안군,전남 신안군 임자면 대기리 산327-2,35.1034735,126.0752247
신안해저유물 발굴 기념비,전남 신안군,전남 신안군 증도면 방축리,35.0102765,126.1231593
신의도,전남 신안군,전라남도 신안군 신의면 신의로 661,34.5847473,126.0884124
신재서원,전남 광양시,전라남도 광양시 광양읍 신재로 110,34.9808694,127.5904302
신전해변,전남 진도군,전라남도 진도군 조도면 조도대로 115-19,34.3090827,126.0494976
신지동고해수욕장,전남 완도군,전라남도 완도군 신지면 신지로 1259-1,34.3296292,126.8799702
신지명사십리 해수욕장,전남 완도군,전라남도 완도군 신지면 명사십리길 85-105,34.3272954,126.8089998
신지명사십리해수욕장,전남 완도군,전라남도 완도군 신지면 명사십리길 85-105,34.3272954,126.8089998
신흥사(완도),전남 완도군,전라남도 완도군 완도읍 청해진남로 101-1,34.3074135,126.7551916
신흥사(장흥),전남 장흥군,전라남도 장흥군 장흥읍 연산리 89,34.6831549,126.8894293
신흥해수욕장,전남 완도군,전라남도 완도군 청산면 청산로672번길 4,34.1836031,126.9070069
심청한옥마을,전남 곡성군,전라남도 곡성군 오곡면 심청로 178,35.231059,127.3572416
심향사(나주),전남 나주시,전라남도 나주시 건재로 41-1,35.0395513,126.7122568
쌍계사(진도),전남 진도군,전라남도 진도군 의신면 운림산방로 299-30,34.4676015,126.3080314
쌍봉사(화순),전남 화순군,전라남도 화순군 이양면 쌍산의로 459,34.8874904,127.0605946
안도해변,전남 여수시,전라남도 여수시 남면 안도해수욕장길 105,34.4904646,127.8125517
안마도,전남 영광군,전라남도 영광군 낙월면 안마도,35.3446841,126.023959
안악해수욕장,전남 함평군,전라남도 함평군 손불면 월천리 1140,35.14005,126.390509
안좌도,전남 신안군,전라남도 신안군 안좌면 중부로 872,34.756094,126.124899
암태 추포해수욕장,전남 신안군,전라남도 신안군 암태면 추엽길 58-59,34.8080944,126.0653884
암태도,전남 신안군,전라남도 신안군 암태면 장단고길 7-63,34.8267592,126.1123451
압록유원지,전남 곡성군,전라남도 곡성군 죽곡면 섬진강로 1012,35.1919932,127.3775366
압해도,전남 신안군,전라남도 신안군 압해읍 천사로 1004,34.8333863,126.3511946
야생화테마랜드,전남 구례군,전라남도 구례군 광의면 온당리,35.2814179,127.4479202
약사사(무안),전남 무안군,"	전라남도 무안군 무안읍 대사동길 15",34.9879171,126.4805239
양덕도(발가락섬),전남 진도군,전라남도 진도군 조도면 가사도길 42-204,34.5172098,126.082357
어룡도 등대,전남 완도군,전라남도 완도군 노화읍 어룡도길 24,34.2871306,126.4749974
억불산,전남 장흥군,전라남도 장흥군 용산면,34.614923,126.9141086
억불산명품테마길,전남 장흥군,전라남도 장흥군 장흥읍 우드랜드길 142,34.6720593,126.9320341
엑스포해양공원,전남 여수시,전라남도 여수시 박람회길 1,34.7502973,127.7472057
여계산,전남 강진군,전라남도 강진군 대구면 사당리,34.5108134,126.7993712
여귀산,전남 진도군,전라남도 진도군 임회면 상만리,34.3799998,126.2203568
여서도(완도),전남 완도군,전라남도 완도군 청산면 여서도길 15,33.9867414,126.9231411
여수 가사리 갈대밭,전남 여수시,전라남도 여수시 소라면 관기길 327,34.7461108,127.5987842
여수 국가산업단지,전남 여수시,전라남도 여수시 해산동,34.8021599,127.639683
여수 낭도리 공룡발자국화석 산지,전남 여수시,전라남도 여수시 화정면 여산길,34.6023768,127.5435271
여수 백도,전남 여수시,전남 여수시 삼산면 거문리,34.027104,127.31632
"여수 석보(구, 석창성지)",전남 여수시,전라남도 여수시 여천동,34.7701054,127.6615897
여수 선소유적,전남 여수시,전라남도 여수시 시전동,34.7604397,127.6738118
여수 안도어촌체험마을,전남 여수시,전라남도 여수시 남면 안도해변길 45,34.4872414,127.8043582
여수 유월드 루지 테마파크,전남 여수시,전라남도 여수시 소라면 안심산길 155,34.7477947,127.6412509
여수 율촌역,전남 여수시,전라남도 여수시 율촌면 당머리길 18,34.8835097,127.5799325
여수 진남관,전남 여수시,전라남도 여수시 동문로 11,34.7413383,127.7366025
여수 충민사,전남 여수시,전라남도 여수시 충민사길 52-23,34.758244,127.7348732
여수 타루비,전남 여수시,전라남도 여수시 고소3길 13,34.7401512,127.7387675
여수 해상케이블카,전남 여수시,전라남도 여수시 돌산읍 돌산로 3600-1,34.73056,127.741572
여수 흥국사 홍교,전남 여수시,전라남도 여수시 흥국사길 160,34.8210752,127.7003341
여수갯벌노을마을,전남 여수시,소라면 사곡리 1198-7번지 1층 장척마을회관 여수시 전라남도 KR,34.7902433,127.5680089
여수구항 해양공원,전남 여수시,전라남도 여수시 중앙동,34.7399174,127.7361151
여수밤바다 낭만버스킹,전남 여수시,전라남도 여수시 중앙동,34.7399174,127.7361151
여수예술랜드,전남 여수시,전라남도 여수시 돌산읍 무술목길 142-1,34.6943489,127.7772002
여수향교,전남 여수시,전라남도 여수시 군자길 46,34.7427701,127.7338076
여자만갯벌,전남 여수시,전라남도 여수시 소라면 해넘이길 205,34.791899,127.5663786
연곡사(구례),전남 구례군,전라남도 구례군 토지면 피아골로 774,35.2545905,127.5892647
연곡서원,전남 장흥군,전라남도 장흥군 장흥읍 연곡길 31,34.6830902,126.9199419
연도(소리도),전남 여수시,전라남도 여수시 남면 연도길,34.434291,127.79933
연홍도,전남 고흥군,전라남도 고흥군 금산면 신전리,34.4535442,127.1127317
연흥사,전남 영광군,전라남도 영광군 군남면 육창로 2,35.1801965,126.4272131
염포마을,전남 고흥군,전라남도 고흥군 봉래면 우주로 3949,34.4223063,127.4930514
염포해수욕장,전남 고흥군,전남 고흥군 봉래면 외초리,34.4298142,127.4992001
영광 법성진 숲쟁이,전남 영광군,전라남도 영광군 법성면 법성리 821-1,35.3652521,126.4441234
영광 성산리지석묘군,전남 영광군,전라남도 영광군 홍농읍 홍농로 708-28,35.4150493,126.4439714
영광 용암마을,전남 영광군,전라남도 영광군 군남면 육창로1길 50-1,35.1965208,126.4344857
영광법성진성,전남 영광군,전라남도 영광군 법성면 진내리,35.3672144,126.4375451
영광정유재란열부순절지,전남 영광군,전라남도 영광군 백수읍 해안로 847-8,35.3348581,126.403065
영광향교,전남 영광군,전라남도 영광군 영광읍 향교길 32,35.2737553,126.5199737
영귀서원,전남 곡성군,전라남도 곡성군 겸면 현정길 49-23,35.2534664,127.1653161
영벽정,전남 화순군,전라남도 화순군 능주면 학포로 1922-53,34.9931822,126.9650412
영보정,전남 영암군,전라남도 영암군 덕진면 영보정길 10-8,34.8297012,126.7323073
영산강,전남 담양군,전라남도 담양군 수북면 개동신기길,35.280678,126.9410159
영산도,전남 신안군,전라남도 신안군 흑산면 영산길 21,34.6527634,125.4672254
영산포 등대,전남 나주시,전라남도 나주시 등대길 80,34.999717,126.7095796
영산포 홍어거리,전남 나주시,전라남도 나주시 영산포로 205-7,34.9994538,126.7100055
영암 영보마을,전남 영암군,전라남도 영암군 덕진면 백룡로 418,34.8288487,126.7316382
영암 왕인박사마을,전남 영암군,전라남도 영암군 군서면 구림로 43-14,34.7608205,126.6276405
영암 왕인촌마을 [농촌체험휴양마을],전남 영암군,전라남도 영암군 군서면 구림로 43-14,34.7608205,126.6276405
영암 장천리 선사주거지,전남 영암군,전라남도 영암군 서호면 선사주거로 308,34.7510628,126.5837907
영암 학계리석불입상,전남 영암군,전라남도 영암군 학산면 학계리,34.6895252,126.6310754
영암내동리쌍무덤,전남 영암군,전라남도 영암군 시종면 내동리,34.8680621,126.6041254
영암최성호가옥,전남 영암군,전라남도 영암군 덕진면 영보정길 10-14,34.8297274,126.7330109
영암향교,전남 영암군,전라남도 영암군 영암읍 교동로 73,34.7971856,126.6937135
영암호(철새도래지),전남 영암군,전라남도 영암군 삼호읍 용앙리,34.7517019,126.4585328
영취산(여수),전남 여수시,전라남도 여수시 상암동,34.8285736,127.7371445
영팔정,전남 영암군,전라남도 영암군 신북면 하정길 8,34.8884434,126.7046291
영화 곡성 촬영지,전남 곡성군,전라남도 곡성군 석곡면 연반여운길 285,35.1713549,127.2228435
예송해수욕장,전남 완도군,전라남도 완도군 보길면 예송리,34.1386422,126.5521925
예술의 섬 장도,전남 여수시,전라남도 여수시 웅천동,34.7471249,127.6840325
예양서원,전남 장흥군,전라남도 장흥군 장흥읍 예양4길 15-7,34.6763491,126.8999758
오거리문화센터(구 동본원사 목포별원),전남 목포시,전라남도 목포시 영산로75번길 5,34.7896731,126.3843358
오동도,전남 여수시,전라남도 여수시 오동도로 222,34.7443435,127.7641302
오동도 등대,전남 여수시,전라남도 여수시 오동도로 238-32,34.7443638,127.7676075
오봉산,전남 보성군,전남 보성군 득량면 해평리,34.7422056,127.1937883
오산(구례),전남 구례군,전라남도 구례군 문척면 사성암길,35.1758333,127.4757193
오산어촌체험마을,전남 해남군,전라남도 해남군 북평면 오산길 88,34.4134018,126.6430956
오시아노 관광단지,전남 해남군,전라남도 해남군 화원면 시아로 552,34.6681524,126.2596757
옥계서원(순천),전남 순천시,전라남도 순천시 명말2길 20,34.9378719,127.514631
옥과향교,전남 곡성군,전라남도 곡성군 옥과면 옥과7길 13,35.2785097,127.1335159
옥련사(강진),전남 강진군,전라남도 강진군 강진읍 옥련사길 86,34.6061148,126.7514397
옥천서원(순천),전남 순천시,전라남도 순천시 임청대길 18,34.9521889,127.4787364
옴천사(강진),전남 강진군,전라남도 강진군 옴천면 장강로 1445-14,34.7370856,126.7928738
옹성산,전남 화순군,전라남도 화순군 이서면,35.1104259,127.0711087
완도 개매기마을,전남 완도군,전라남도 완도군 소안면 월항길 32,34.174664,126.6509363
완도 맹선리 상록수림,전남 완도군,전라남도 완도군 소안면 소안로 1107,34.1505516,126.636544
완도 묘당도 이충무공 유적,전남 완도군,전라남도 완도군 고금면 세동84번길 86-31,34.4004387,126.8597502
완도 미라리 상록수림,전남 완도군,전라남도 완도군 소안면 미라리 472,34.1452249,126.669434
완도 울모래마을,전남 완도군,전라남도 완도군 신지면 신지로582번길 84,34.3268293,126.8303226
완도 정도리 구계등,전남 완도군,전라남도 완도군 완도읍 구계등길 47-1,34.2983518,126.7092079
완도 청산도,전남 완도군,전라남도 완도군 청산면 도청길 일대,34.1808532,126.8595855
완도 청해진 유적,전남 완도군,전라남도 완도군 완도읍 청해진로 1380-138,34.3537084,126.7173033
완도 청해포구촬영장,전남 완도군,전라남도 완도군 완도읍 청해진서로 1161-8,34.3242384,126.6706633
완도수목원,전남 완도군,전라남도 완도군 군외면 초평1길 156,34.3606378,126.6644261
완도타워,전남 완도군,전라남도 완도군 완도읍 장보고대로 330,34.3118294,126.7645011
완도향교,전남 완도군,전라남도 완도군 완도읍 죽청길 94-73,34.3459635,126.7278116
왕인박사유적지,전남 영암군,전라남도 영암군 군서면 왕인로 440,34.7555659,126.6299326
외나로도,전남 고흥군,전라남도 고흥군 고흥읍 우주로,34.5997964,127.301546
외달도,전남 목포시,전라남도 목포시 외달도길 72,34.7814053,126.2966428
외달도 해수욕장,전남 목포시,전라남도 목포시 외달도길 47-17,34.7806128,126.2940525
외동어촌체험마을,전남 여수시,전라남도 여수시 대경도4길 41-1,34.7178651,127.7279743
용강서원,전남 순천시,전라남도 순천시 공마당1길 64,34.9555832,127.4762985
용문사(여수),전남 여수시,전라남도 여수시 화양면 용문사길 91,34.7259246,127.6127531
용바위터,전남 고흥군,전라남도 고흥군 영남면 우천리,34.6163737,127.490814
용산서원(보성),전남 보성군,전라남도 보성군 미력면 덕림리,34.7980396,127.1060836
용산재,전남 곡성군,전라남도 곡성군 목사동면 신숭겸로 226,35.1311395,127.3208549
용암산,전남 화순군,전라남도 화순군 한천면 용암길,34.9675606,126.9985614
용지동계곡,전남 구례군,전라남도 구례군 간전면 용지동길 226,35.1132367,127.545303
용천사 꽃무릇공원,전남 함평군,전라남도 함평군 해보면 용천사길 209,35.1836127,126.5448913
용천사 석등,전남 함평군,전라남도 함평군 해보면 용천사길 209,35.1836127,126.5448913
용천사(함평),전남 함평군,전라남도 함평군 해보면 용천사길 209,35.1836127,126.5448913
용추폭포계곡,전남 보성군,전라남도 보성군 웅치면 용추덕림길 89-84,34.6944932,127.0113414
용호정원림,전남 장흥군,전라남도 장흥군 부산면 용반1길 213-34,34.7506853,126.8994083
용화사(담양),전남 담양군,전라남도 담양군 담양읍 남촌길 77,35.313194,126.9901375
용흥사(담양),전남 담양군,전라남도 담양군 월산면 용흥사길 442,35.3410238,126.8890444
우도(고흥),전남 고흥군,전라남도 고흥군 남양면 우도길,34.7213363,127.3123996
우암 송시열 글쓴바위,전남 완도군,전남 완도군 보길면 중통리 1-1,34.1573683,126.6217385
우이도,전남 신안군,전라남도 신안군 도초면 우이진리길 47-9,34.6179653,125.8532079
우이도 돈목해수욕장,전남 신안군,전라남도 신안군 도초면 돈목길 33-1,34.6015839,125.8242413
우항리 공룡화석자연사유적지,전남 해남군,전라남도 해남군 황산면 공룡박물관길 234,34.589965,126.4368019
운암사(광양),전남 광양시,전라남도 광양시 옥룡면 운암길 83,35.0466242,127.6079069
운암산(고흥),전남 고흥군,전라남도 고흥군 포두면 송산리,34.6062257,127.3655625
운주사,전남 화순군,전라남도 화순군 도암면 천태로 91-44,34.925825,126.8800984
운흥사(나주),전남 나주시,전라남도 나주시 다도면 암정로 398,34.9084381,126.8019765
운흥정,전남 구례군,전라남도 구례군 산동면 구만제로 973-54,35.3067586,127.4323165
웅천친수공원,전남 여수시,전라남도 여수시 예울마루로 37-40,34.7465311,127.6700414
웅치관광농원,전남 보성군,전라남도 보성군 웅치면 서동길 227,34.7214878,127.0042085
원갑사,전남 무안군,전라남도 무안군 해제면 산길로 266-27,35.0905332,126.2622893
원불교영산성지,전남 영광군,전라남도 영광군 백수읍 성지로 1345,35.32563,126.441108
원주도,전남 고흥군,전라남도 고흥군 과역면 원당길 106,34.6714645,127.4712622
월남사지,전남 강진군,전라남도 강진군 성전면 월남1길 100,34.7426507,126.7116299
월선체험 휴양마을,전남 무안군,전라남도 무안군 청계면 예술촌길 148,34.8919145,126.4562533
월정서원,전남 나주시,전라남도 나주시 노안면,35.0759336,126.7322183
월출산 기찬랜드,전남 영암군,전라남도 영암군 영암읍 기찬랜드로 19-3,34.7922651,126.6859479
월출산국립공원,전남 영암군,전라남도 영암군 영암읍 천황사로 280-43,34.7750486,126.7218085
월출산국립공원,전남 영암군,전라남도 영암군 영암읍 천황사로 280-43,34.7750486,126.7218085
월출산온천,전남 영암군,전라남도 영암군 군서면 마한로 331,34.8159253,126.656241
위안 산촌마을,전남 구례군,전라남도 구례군 산동면 산수유꽃길로 227,35.3304046,127.4879342
유달산,전남 목포시,전남 목포시 죽교동 산27-3,34.7941602,126.3711562
유달산 달성공원,전남 목포시,전라남도 목포시 유달로 174-2,34.7909948,126.3766323
유달산 조각공원,전남 목포시,전라남도 목포시 유달로 221,34.7944777,126.3738652
유마사,전남 화순군,전라남도 화순군 사평면 유마로 603,35.0187952,127.1715001
유치자연휴양림,전남 장흥군,전라남도 장흥군 유치면 휴양림길 154,34.7692599,126.8330445
율도,전남 신안군,전라남도 신안군 지도읍 누동길 30-40,35.0332893,126.2717699
율봉서원,전남 순천시,전라남도 순천시 별량면 우산리,34.8799043,127.475366
율포해수녹차센터,전남 보성군,전라남도 보성군 회천면 우암길 21,34.6704268,127.0887324
율포해수욕장(솔밭해변),전남 보성군,전라남도 보성군 회천면 우암길 24,34.6701079,127.0891309
율포해수풀장,전남 보성군,전라남도 보성군 회천면 우암길 8,34.6701945,127.0872085
은적사(여수),전남 여수시,전라남도 여수시 돌산읍 돌산로 1168-58,34.6190051,127.7345046
은적사(해남),전남 해남군,전라남도 해남군 마산면 은적사길 404,34.5976101,126.6014778
읍리지석묘와 하마비,전남 완도군,전라남도 완도군 청산면 읍리,34.1696997,126.8771148
의마총,전남 곡성군,전라남도 곡성군 입면 송전종방길 222,35.3194369,127.1865717
이난영의 목포의 눈물 노래비,전남 목포시,전라남도 목포시 죽교동,34.7966426,126.368521
