name,region,address,lat,lon
덕룡산,전남 강진군,전라남도 강진군 도암면 봉황리,34.5447827,126.6933119
덕양사,전남 곡성군,전라남도 곡성군 오곡면 덕양서원길 42,35.2634377,127.3106056
덕양서원(고흥),전남 고흥군,전라남도 고흥군 동일면 성두구룡길 132,34.5283512,127.4429534
덕양서원(곡성),전남 곡성군,전라남도 곡성군 오곡면 덕양서원길 42,35.2634377,127.3106056
덕흥해수욕장,전남 고흥군,전라남도 고흥군 동일면 덕흥양쪽길 118,34.5289413,127.4584949
도갑사,전남 영암군,전라남도 영암군 군서면 도갑사로 306,34.7535665,126.6621056
도곡원네스 리조트,전남 화순군,전라남도 화순군 도곡면 온천1길 45,35.0289633,126.9029181
도덕사(무안),전남 무안군,전라남도 무안군 무안읍 몽탄로 385-35,34.9716773,126.5129923
도룡마을,전남 강진군,전라남도 강진군 병영면 도룡길 2,34.6987933,126.8278373
도리산전망대,전남 진도군,전라남도 진도군 조도면 여미리,34.3292495,126.0093108
도리포,전남 무안군,전라남도 무안군 해제면,35.1104334,126.2945565
도림사 계곡,전남 곡성군,전라남도 곡성군 곡성읍 월봉리,35.2726984,127.2488747
도림사(곡성),전남 곡성군,전라남도 곡성군 곡성읍 도림로 175,35.2670616,127.2576332
도선국사마을,전남 광양시,전라남도 광양시 옥룡면 상산길 48,35.0443893,127.5933568
도선암(순천),전남 순천시,전라남도 순천시 상사면 도선길 202-160,34.9095907,127.4271465
도원서원,전남 화순군,전라남도 화순군 동복면 연곡길 137,35.0812719,127.120544
도장사(해남),전남 해남군,전라남도 해남군 황산면 내산길 143,34.6097862,126.3833592
도초 시목해수욕장,전남 신안군,전라남도 신안군 도초면 시목길 219-30,34.673278,125.9510914
도초도,전남 신안군,전라남도 신안군 도초면 수항리,34.691953,125.9617597
독거도,전남 진도군,전라남도 진도군 조도면 독거도길 26-4,34.2540276,126.180963
독상리석등,전남 화순군,전라남도 화순군 동복면 석등길 1,35.0709352,127.1280153
돌머리어촌체험마을,전남 함평군,전라남도 함평군 함평읍 주포로 600-29,35.0863281,126.4402822
돌머리해변,전남 함평군,전라남도 함평군 함평읍 주포로 614,35.0865709,126.4419235
돌산 평사리 고니도래지,전남 여수시,전라남도 여수시 돌산읍 안굴전길,34.6952463,127.7714362
돌산갓 장터마을,전남 여수시,전라남도 여수시 돌산읍 향일암로 359,34.6049703,127.7876963
돌산공원,전남 여수시,전라남도 여수시 돌산읍 돌산로 3600-1,34.73056,127.741572
돌산대교,전남 여수시,전라남도 여수시 돌산읍 돌산로 3617-7,34.665556,127.7529493
돌산도,전남 여수시,전라남도 여수시 돌산읍,34.6171756,127.7216946
돌산향교,전남 여수시,전라남도 여수시 돌산읍 돌산로 1196-3,34.665556,127.7529493
동거차도,전남 진도군,전라남도 진도군 조도면 동거차동육길 50,34.2386196,125.9397098
동복향교,전남 화순군,전라남도 화순군 동복면 월송길 62-30,35.0753986,127.1197211
동악산 (곡성),전남 곡성군,전라남도 곡성군 곡성읍 학정리,35.2901309,127.2647414
동천석실,전남 완도군,전라남도 완도군 보길면 부황리,34.1535985,126.5440524
동학농민혁명기념탑,전남 장흥군,전라남도 장흥군 장흥읍 읍성로 2,34.6767888,126.9028125
두계외갓집체험마을,전남 곡성군,전라남도 곡성군 고달면 두계길 126,35.2435269,127.3791088
두레아트(관광두레 주민사업체),전남 순천시,전라남도 순천시 삼산로 157,34.9720702,127.4889304
두륜산도립공원,전남 해남군,전라남도 해남군 삼산면 대흥사길 400,34.4763245,126.6168261
두륜산케이블카,전남 해남군,전라남도 해남군 삼산면 대흥사길 88-45,34.496726,126.6253727
둔병대교(여수),전남 여수시,전라남도 여수시 화정면 조발리 산70,34.6294659,127.5547323
득량도,전남 고흥군,전라남도 고흥군 도양읍 득량관선길 91,34.6003088,127.1034274
득량역 추억의 거리,전남 보성군,전라남도 보성군 득량면 역전길 28,34.7614657,127.1701829
들풀미술학교,전남 보성군,전라남도 보성군 웅치면 대산길 265-6,34.6999747,126.9941255
디오션리조트 워터파크,전남 여수시,전라남도 여수시 소호로 295,34.7318405,127.6438729
땅끝관광지,전남 해남군,전라남도 해남군 송지면 땅끝마을길 42,34.2997332,126.52741
땅끝길,전남 해남군,전라남도 해남군 송지면 땅끝마을길 42,34.2997332,126.52741
땅끝모노레일,전남 해남군,전라남도 해남군 송지면 땅끝마을길 42,34.2997332,126.52741
땅끝송호마을,전남 해남군,전라남도 해남군 송지면 송호길 35,34.3172033,126.5217846
땅끝황토나라테마촌,전남 해남군,전라남도 해남군 송지면 땅끝해안로 1730,34.3706011,126.5315651
띠밭넘어해변,전남 신안군,전라남도 신안군 도초면 우이도리,34.6102599,125.8421653
라배도(나배도),전남 진도군,전라남도 진도군 조도면 나배도길,34.3126229,126.0117667
마량미항(마량항),전남 강진군,전라남도 강진군 마량면 마량리,34.4569463,126.8249982
마복산,전남 고흥군,전라남도 고흥군 포두면 남성리,34.524243,127.3996075
마복산 목재문화체험장,전남 고흥군,전라남도 고흥군 포두면 우주로 1306,34.5502172,127.376241
마천목장군과 도깨비살,전남 곡성군,전라남도 곡성군 석곡면 방주마천목길 135-2,35.1329909,127.254162
마한문화공원,전남 영암군,전라남도 영암군 시종면 남해당로 65,34.8954066,126.584196
만덕산,전남 강진군,전라남도 강진군 강진읍 덕남리,34.5990077,126.7589669
만성리 검은모래해변,전남 여수시,전라남도 여수시 만성리길 15-1,34.7758476,127.7446357
만연사 선캄브리아기 화강편마암 (무등산권 국가지질공원),전남 화순군,전라남도 화순군 화순읍 동구리,35.0859073,126.9870344
만연사(화순),전남 화순군,전라남도 화순군 화순읍 진각로 367,35.0829623,126.9849879
만연산,전남 화순군,전라남도 화순군 화순읍 진각로,35.0623017,126.9863222
만연폭포,전남 화순군,전라남도 화순군 화순읍 안양산로,35.0824953,127.0061174
만재도,전남 신안군,전라남도 신안군 흑산면 만재도길 36-8,34.208614,125.4708083
망금산 강강술래터,전남 진도군,전라남도 진도군 군내면 명량대첩로 101,34.5628247,126.309401
망끝전망대,전남 완도군,전남 완도군 보길면 정자리,34.1625732,126.521793
매천사,전남 구례군,전라남도 구례군 광의면 월곡길 22-3,35.2528277,127.4621521
맹골도,전남 진도군,전라남도 진도군 조도면 맹골도길 14-4,34.2164449,125.853733
면앙정,전남 담양군,전라남도 담양군 봉산면 면앙정로 382-11,35.2843595,126.9630124
명곡서원,전남 강진군,전라남도 강진군 군동면 신기길 63,34.6572122,126.8493906
명량해협 울돌목,전남 진도군,전라남도 진도군 군내면 녹진리,34.5634896,126.282317
모도,전남 진도군,전라남도 진도군 의신면 모도길 12-3,34.4073919,126.3555951
모래미 해변,전남 영광군,전라남도 영광군 백수읍 해안로 1389,35.363262,126.4157932
모사금해수욕장,전남 여수시,전라남도 여수시 오천동,34.7960528,127.7391026
모암마을 [산촌체험마을],전남 장성군,전라남도 장성군 서삼면,35.3341468,126.7672129
모평마을,전남 함평군,전라남도 함평군 해보면 상모길 80,35.1603505,126.5944642
모후산,전남 화순군,전라남도 화순군 사평면 유마로,35.0021819,127.1683505
목포 갓바위,전남 목포시,전라남도 목포시 남농로 149,34.7938433,126.4226369
목포 관광특구,전남 목포시,전남 목포시,34.8118351,126.3921664
목포 서산동 보리마당&시화마을,전남 목포시,전라남도 목포시 해안로127번길 14-2,34.7817268,126.3773656
목포 오포대,전남 목포시,전라남도 목포시 유달로 180,34.7913294,126.3766487
목포 해상케이블카,전남 목포시,전라남도 목포시 해양대학로 240,34.7954321,126.3681082
목포대교,전남 목포시,전라남도 목포시 고하대로597번길 73,34.798436,126.3600566
목포시 특정자생식물원,전남 목포시,전라남도 목포시 유달로 203,34.7906962,126.3743841
목포시사,전남 목포시,전라남도 목포시 유달로 165,34.7900816,126.3772314
목포역(철도체험학습장),전남 목포시,전라남도 목포시 영산로 98,34.7925552,126.3881726
목포평화광장,전남 목포시,전라남도 목포시 평화로 82,34.7962418,126.4330296
묘장영당,전남 영광군,전라남도 영광군 묘량면 동삼로1길 21,35.2597805,126.5475012
무등산,전남 화순군,전남 화순군 이서면,35.1104259,127.0711087
무등산 양떼목장,전남 화순군,전라남도 화순군 화순읍 안양산로 537,35.0948162,127.0123352
무등산편백자연휴양림(안양산자연휴양림),전남 화순군,전라남도 화순군 이서면 안양산로 685,35.0928526,127.0282371
무등암,전남 광양시,전라남도 광양시 다압면 백운3로 635-18,35.0557223,127.743807
무령서원,전남 영광군,전라남도 영광군 영광읍 와룡로2길 16,35.2895799,126.5037173
무안 감풀마을 [농촌전통테마],전남 무안군,전라남도 무안군 현경면 외반리,35.0161152,126.41396
무안 도요지,전남 무안군,전라남도 무안군 몽탄면 몽탄로 940-1,34.9236732,126.4995728
무안 박봉기 가옥,전남 무안군,전라남도 무안군 무안읍 수양길 104-13,35.0142032,126.4513609
무안 발산마을미륵당산,전남 무안군,전라남도 무안군 해제면 광산리,35.1030418,126.2845629
무안 백련흑콩마을(두레미마을),전남 무안군,전라남도 무안군 일로읍 백련로 365,34.8577072,126.531986
무안 식영정,전남 무안군,전라남도 무안군 몽탄면 호반로 562-15,34.9286479,126.5162339
무안 용월리 백로와 왜가리 번식지,전남 무안군,전라남도 무안군 무안읍 백로로 266-1,35.0132812,126.4870961
무안 유교리고가,전남 무안군,전라남도 무안군 삼향읍 유교길 53-5,34.8471762,126.4379151
무안 청천리 팽나무와 개서어나무 숲,전남 무안군,전라남도 무안군 청계면 청천길 71-6,34.9674862,126.4599349
무안 하늘백련마을(백련지마을),전남 무안군,전라남도 무안군 일로읍 백련로 339-2,34.8593817,126.5300262
무안갯벌,전남 무안군,전라남도 무안군 해제면 용산길 140,35.1037694,126.3321981
무안망운면의곰솔,전남 무안군,전라남도 무안군 망운면 두모길 35,35.0076499,126.3681149
무안향교,전남 무안군,전라남도 무안군 무안읍 향교길 20,34.989621,126.4677228
무안황토갯벌랜드(구 무안생태갯벌센터),전남 무안군,전라남도 무안군 해제면 만송로 36,35.0989084,126.3348337
무안회산백련지,전남 무안군,전라남도 무안군 일로읍 백련로 333,34.8692148,126.5150619
무열사(나주),전남 나주시,전라남도 나주시 다시면 무숙로 637-31,35.0038109,126.6337849
무월마을,전남 담양군,전라남도 담양군 대덕면 무월길 42,35.2664259,127.0399236
무위사,전남 강진군,전라남도 강진군 성전면 무위사로 308,34.7384596,126.6868637
무한의다리,전남 신안군,전라남도 신안군 자은면 한운리 산231-1,34.9203271,126.0590128
문성암,전남 나주시,전라남도 나주시 다도면 암정로 325-37,34.9149881,126.8076965
물염적벽,전남 화순군,전라남도 화순군 이서면 물염로,35.129887,127.1009625
물염정,전남 화순군,전라남도 화순군 이서면 물염로 161,35.1320488,127.1063245
미강서원,전남 순천시,전라남도 순천시 해룡면 해광로 175,34.9244592,127.5549524
미덕도,전남 고흥군,전라남도 고흥군 과역면 백일길 63-118,34.7117478,127.414668
미라리해수욕장,전남 완도군,전남 완도군 소안면 미라리,34.1480951,126.6558301
미라마을,전남 완도군,전라남도 완도군 소안면 소안로549번길,34.1466288,126.6727104
미륵사(나주),전남 나주시,전라남도 나주시 봉황면 세남로 408-64,34.9384189,126.7810449
미천서원,전남 나주시,전라남도 나주시 미천서원길 14-11,35.0045725,126.6876121
미황사,전남 해남군,전라남도 해남군 송지면 미황사길 164,34.3827629,126.5776828
박산서원,전남 강진군,전라남도 강진군 작천면 박산죽현길 107-56,34.7036695,126.7488243
반달가슴곰생태학습장,전남 구례군,전라남도 구례군 마산면 화엄사로 402-31,35.2428712,127.4903881
반월도·박지도,전남 신안군,전라남도 신안군 안좌면,34.7560627,126.1246383
발포해수욕장,전남 고흥군,전라남도 고흥군 도화면 천마로 2743,34.4925254,127.3569696
방산서원,전남 구례군,전라남도 구례군 산동면 둔사길 36-13,35.2850238,127.4159958
방죽포해변,전남 여수시,전라남도 여수시 돌산읍 향일암로 804-6,34.6308684,127.7924935
방호정(구례),전남 구례군,전라남도 구례군 산동면 좌사리,35.3117831,127.5184875
배알도 수변공원,전남 광양시,전라남도 광양시 명당길 160-16,34.9591441,127.7594585
배중손 사당,전남 진도군,전라남도 진도군 임회면 진도대로 4212,34.3694033,126.1998092
백련사(강진),전남 강진군,전라남도 강진군 도암면 백련사길 145,34.5880354,126.7476576
백바위해수욕장,전남 영광군,전라남도 영광군 염산면 칠산로 836,35.2376799,126.3039602
백수해안도로,전남 영광군,전라남도 영광군 백수읍 대신리,35.3390142,126.3980528
백아산,전남 화순군,전라남도 화순군 백아면 용촌길,35.1606006,127.1484305
백아산 관광목장,전남 화순군,전라남도 화순군 백아면 백아로 1310-56,35.1761024,127.1406124
백아산자연휴양림,전남 화순군,전라남도 화순군 백아면 수양로 353,35.1521797,127.1681978
백암산(장성),전남 장성군,전라남도 장성군 북하면 신성리,35.4451119,126.8486041
백야도 등대,전남 여수시,전라남도 여수시 화정면 백야등대길 48,34.6092535,127.6540948
백양사,전남 장성군,전라남도 장성군 북하면 백양로 1239,35.4392036,126.8832322
백운사(광양),전남 광양시,전라남도 광양시 옥룡면 백운사길 352,35.0918055,127.6169276
백운산 구시폭포,전남 광양시,전라남도 광양시 옥룡면 동곡리,35.08885,127.6112577
백운산 동곡계곡,전남 광양시,전라남도 광양시 옥룡면 약수제단길 154,35.0693957,127.6315175
백운산 어치계곡,전남 광양시,전라남도 광양시 진상면 백학로 531,35.0630786,127.690433
백운산(광양),전남 광양시,전라남도 광양시 옥룡면,35.0169412,127.61933
백운산자연휴양림,전남 광양시,전라남도 광양시 옥룡면 백계로 337,35.05205,127.5985511
백운산자연휴양림,전남 광양시,전라남도 광양시 옥룡면 백계로 337,35.05205,127.5985511
백일도,전남 고흥군,전라남도 고흥군 과역면 백일길 315-4,34.6989018,127.4293576
백제불교최초도래지,전남 영광군,전라남도 영광군 법성면 백제문화로 203,35.3618569,126.4310922
백학동마을,전남 광양시,전라남도 광양시 진상면 신황길 66,35.0525472,127.6868812
범바위,전남 완도군,전라남도 완도군 청산면 청계리,34.161174,126.9033584
법성포,전남 영광군,전라남도 영광군 법성면 법성리,35.3659653,126.4481861
법천사·목우암,전남 무안군,전라남도 무안군 몽탄면 법천길 529,34.9146495,126.4563847
법흥사(영암),전남 영암군,전라남도 영암군 금정면 연지길 121,34.8898617,126.7710831
별나로마을,전남 고흥군,전라남도 고흥군 포두면 상오길 65,34.574248,127.4045251
병영성홍교,전남 강진군,전라남도 강진군 병영면 성동리,34.7217217,126.8137688
병풍산,전남 담양군,전남 담양군 대전면 평장리 142,35.2860656,126.8758193
보광사(광양),전남 광양시,전라남도 광양시 광양읍 서북4길 30,34.9732326,127.5776296
보광사(담양),전남 담양군,전라남도 담양군 금성면 매곡길 49-15,35.3172456,127.0169371
보광사(함평),전남 함평군,전라남도 함평군 함평읍 한재골길 26-32,35.0651917,126.5083459
보길도,전남 완도군,전라남도 완도군 보길면,34.1690772,126.5676334
보길도 뾰쪽산과 보옥리 공룡알해변,전남 완도군,전남 완도군 보길면 보옥리,34.1543815,126.5406825
보길도 세연정,전남 완도군,전라남도 완도군 보길면 부황길 57,34.1624477,126.5559923
보길도 윤선도 원림,전남 완도군,전라남도 완도군 보길면 부황길 57,34.1624477,126.5559923
보리암(담양),전남 담양군,전라남도 담양군 용면 월계길 37-17,35.4048312,126.9926542
보림사(장흥),전남 장흥군,전라남도 장흥군 유치면 보림사로 224,34.8079075,126.8961114
보산정사,전남 나주시,전라남도 나주시 다시면 무숙로 647-6,35.0040143,126.6352002
보성 강골마을,전남 보성군,전라남도 보성군 득량면 역전길 15-9,34.7627107,127.1691349
보성 골망태다원,전남 보성군,전라남도 보성군 보성읍 노산길 5-56,34.7362399,127.0922027
보성 벌교 갯벌,전남 보성군,전라남도 보성군 벌교읍 장호길 368,34.8274031,127.3943752
보성 벌교 홍교,전남 보성군,전라남도 보성군 벌교읍 벌교리,34.8454492,127.3396877
보성 비봉리 공룡알화석 산지,전남 보성군,전남 보성군 득량면 비봉리,34.7169709,127.1893472
보성강,전남 곡성군,전라남도 곡성군 목사동면,35.1207433,127.2999574
보성싱싱농원,전남 보성군,전라남도 보성군 조성면 봉능리,34.7988119,127.2197745
보성향교,전남 보성군,전라남도 보성군 보성읍 중앙로 58-23,34.7686746,127.0840325
보은산,전남 강진군,전남 강진군 강진읍 동성리,34.6431739,126.7725775
보해매실농원,전남 해남군,전라남도 해남군 산이면 예덕길 125-89,34.6243948,126.463392
복암사(나주),전남 나주시,전라남도 나주시 다시면 가운길 145,35.0241841,126.6623836
봄의 왈츠 드라마 촬영지,전남 완도군,전라남도 완도군 청산면 청산로 136,34.1696831,126.8624148
봇재다원,전남 보성군,전라남도 보성군 회천면 녹차로 745-4,34.7128907,127.0857593
봉강사,전남 나주시,전라남도 나주시 문평면 오룡리,35.0534902,126.6130097
봉대산,전남 강진군,전라남도 강진군 강진읍 덕남리,34.5990077,126.7589669
봉래사,전남 고흥군,전라남도 고흥군 봉래면 우주로 3159-32,34.4649638,127.4638152
봉래산,전남 고흥군,전라남도 고흥군 봉래면 외초리,34.4298142,127.4992001
봉암서원,전남 장성군,전라남도 장성군 장성읍 화차길 159,35.3220453,126.7880376
봉조농촌체험학교,전남 곡성군,전라남도 곡성군 오곡면 봉조길 114,35.2144175,127.3603791
봉하산촌마을,전남 화순군,전라남도 화순군 도암면 봉수길 77,34.8864999,126.8737633
부용산(장흥),전남 장흥군,전라남도 장흥군 관산읍 남송성산길,34.5795783,126.8946302
부춘정원림,전남 장흥군,전라남도 장흥군 부산면 부춘길 79,34.7116035,126.9088559
불갑사 관광지,전남 영광군,전라남도 영광군 불갑면 불갑사로 450,35.2014413,126.548957
불갑사(영광),전남 영광군,전라남도 영광군 불갑면 불갑사로 450,35.2014413,126.548957
불갑산도립공원,전남 영광군,전라남도 영광군 불갑면 불갑사로 450,35.2014413,126.548957
불갑저수지 수변공원,전남 영광군,전라남도 영광군 불갑면 방마로 151,35.2214751,126.5142509
불회사(나주),전남 나주시,전라남도 나주시 다도면 다도로 1224-142,34.9084081,126.8229434
비금 원평/하누넘해수욕장,전남 신안군,전라남도 신안군 비금면 하누넘해수욕장길 246,34.7506912,125.8968884
비금도,전남 신안군,전라남도 신안군 비금면 죽림리,34.736717,125.9223713
비금도 내촌마을 옛 담장,전남 신안군,전라남도 신안군 비금면 효자촌길 16,34.7406938,125.9017756
빅오쇼,전남 여수시,전라남도 여수시 수정동 351-1,34.7484417,127.7501068
빛가람 전망대,전남 나주시,전라남도 나주시 호수로 77,35.0170633,126.7905867
뾰족산(보죽산),전남 완도군,전라남도 완도군 보길면 부황리,34.1535985,126.5440524
사구미해변,전남 해남군,전라남도 해남군 송지면 사구미길 20,34.321453,126.5807096
사도,전남 여수시,전라남도 여수시 화정면 사도길 8-1,34.5927009,127.5556022
사산사,전남 함평군,전라남도 함평군 나산면 사산길 38-35,35.1362948,126.6030775
사성암(구례),전남 구례군,전라남도 구례군 문척면 사성암길 303,35.1798591,127.4807873
사양도,전남 고흥군,전라남도 고흥군 봉래면 사양선창길 63,34.4766369,127.4450532
사의재저잣거리,전남 강진군,전라남도 강진군 강진읍 탐진로 155,34.6438537,126.7713233
사평폭포,전남 화순군,전라남도 화순군 사평면 사호로,35.0101645,127.0891224
산이반도,전남 해남군,전남 해남군 산이면,34.6447037,126.4479239
삼문산,전남 완도군,전남 완도군 약산면,34.3936302,126.8981937
삼수마을,전남 보성군,전라남도 보성군 웅치면 유봉길 55,34.706369,127.0520736
삼우당충선공강성군부민후 문익점 부조묘,전남 보성군,전라남도 보성군 미력면 도개2길 21,34.8055614,127.0870618
삼학도,전남 목포시,전라남도 목포시 삼학로92번길,34.783963,126.3928515
삼화관광농원,전남 곡성군,전라남도 곡성군 입면 삼오삼응길 68,35.2890641,127.1762249
상구자도,전남 진도군,전라남도 진도군 의신면 구자도1길 17,34.3287338,126.2998829
상서마을 옛 돌담길,전남 완도군,전라남도 완도군 청산면 상동길 91-1,34.1758955,126.9070532
상왕산,전남 완도군,전남 완도군 군외면,34.3894023,126.6474354
상조도,전남 진도군,전라남도 진도군 조도면 조도대로 1298,34.3207705,126.0385592
상하죽도,전남 진도군,전라남도 진도군 조도면 서거차대섬길,34.2509147,125.9253797
상화도(고흥),전남 고흥군,전라남도 고흥군 도양읍 상화도길,34.5028033,127.1482648
생일도,전남 완도군,전라남도 완도군 생일면,34.3330926,126.9976272
서거차도,전남 진도군,전라남도 진도군 조도면 서거차도1길,34.2551876,125.9137864
서남문대교,전남 신안군,전라남도 신안군 비금면,34.7554486,125.9267163
서동사(해남),전남 해남군,전라남도 해남군 화원면 절골길 244,34.689377,126.3101567
서산사(곡성),전남 곡성군,전라남도 곡성군 곡성읍 교촌길 71,35.2835821,127.2814693
서산사(신안),전남 신안군,전라남도 신안군 비금면 서산길 260,34.7517607,125.9043926
서유리 공룡화석지 (무등산권 국가지질공원),전남 화순군,전라남도 화순군 백아면 백아로 2080,35.1667803,127.1117671
석천사(여수),전남 여수시,전라남도 여수시 충민사길 52-21,34.758244,127.7348732
선소어촌체험마을,전남 보성군,전라남도 보성군 득량면 공룡로 806-32,34.7046037,127.1910894
선암사[유네스코 세계문화유산],전남 순천시,전라남도 순천시 승주읍 선암사길 450,34.9967199,127.3305972
선암사계곡,전남 순천시,전라남도 순천시 승주읍 선암사길 450,34.9967199,127.3305972
선학동 마을,전남 장흥군,전라남도 장흥군 회진면 가학회진로 1212,34.4622343,126.9404894
선학동마을,전남 장흥군,전라남도 장흥군 회진면 회진리 200,34.4595644,126.9359553
설재서원,전남 나주시,전라남도 나주시 노안면 영안길 60,35.0667227,126.7028973
섬진강,전남 곡성군,전남 곡성군 옥과면,35.2768147,127.1356374
섬진강 다무락마을 [녹색관광마을],전남 구례군,전라남도 구례군 구례읍 중유길 64,35.1991003,127.4070574
섬진강 도깨비마을,전남 곡성군,전라남도 곡성군 고달면 호곡도깨비길 119-97,35.2537765,127.3623998
섬진강 생태탐방로,전남 구례군,전라남도 구례군 문척면 죽마리 838,35.1733592,127.4698327
섬진강기차마을,전남 곡성군,전라남도 곡성군 오곡면 기차마을로 232,35.2780945,127.3074651
"섬진강두꺼비, 여행자카페 1933오후(관광두레 주민사업체)",전남 곡성군,전라남도 곡성군 곡성읍 읍내18길 6,35.2824468,127.2985985
섬진강문화학교,전남 곡성군,전라남도 곡성군 죽곡면 태안로 793,35.148348,127.3603367
섬진강변 유원지,전남 곡성군,전라남도 곡성군 고달면 두가리,35.2527786,127.3842354
성기동국민관광지,전남 영암군,전라남도 영암군 군서면 왕인로 440,34.7555659,126.6299326
성남도,전남 진도군,전라남도 진도군 조도면 성남도길,34.3978021,126.0464143
성도사,전남 해남군,전라남도 해남군 북평면 백도로 543-134,34.4511865,126.6436764
성도암(해남),전남 해남군,전라남도 해남군 북평면 동촌길 42-82,34.441184,126.6363869
성륜사(곡성),전남 곡성군,전라남도 곡성군 옥과면 미술관로 287,35.2970498,127.1207106
성불계곡,전남 광양시,전라남도 광양시 봉강면 성불로 1150-14,35.08037,127.5666475
